Top queries,Clicks,Impressions,CTR,Position
bethany ok faux wooden blinds,0,1,0%,17
bethany ok roman shades,0,1,0%,17
bethany ok wooden blinds for windows,0,1,0%,17
collinsville ok automatic blinds,0,1,0%,17
coweta ok automatic blinds,0,1,0%,17
edmond ok interior plantation shutters,0,1,0%,17
el reno ok motorized blackout shades,0,1,0%,17
mustang ok cordless blinds for windows,0,1,0%,17
mustang ok motorized outdoor shades,0,1,0%,17
mustang ok roman shade,0,1,0%,17
mustang ok wooden blinds for windows,0,1,0%,17
nw oklahoma city ok sheer fabric shades,0,1,0%,17
piedmont ok faux wooden blinds,0,1,0%,17
yukon ok cellular shade,0,1,0%,17
yukon ok electric blinds,0,1,0%,17
yukon ok motorized blinds,0,1,0%,17
bethany ok custom blind,0,1,0%,18
bethany ok roman shades blackout,0,1,0%,18
coweta ok motorized blackout shades,0,1,0%,18
coweta ok motorized window shades,0,1,0%,18
edmond ok cordless mini blinds,0,1,0%,18
edmond ok roman shades blackout,0,1,0%,18
mustang ok exterior roller shades,0,1,0%,18
nw oklahoma city ok wood blinds,0,1,0%,18
piedmont ok blinds for skylights,0,1,0%,18
sapulpa ok motorized window shades,0,1,0%,18
sapulpa ok motorized window treatment,0,1,0%,18
sapulpa ok sheer roman shades,0,1,0%,18
yukon ok automatic blinds,0,1,0%,18
yukon ok cordless mini blinds,0,1,0%,18
yukon ok electric blinds for windows,0,1,0%,18
yukon ok faux wood blinds,0,1,0%,18
yukon ok motorized window shades,0,1,0%,18
coweta ok sheer roller shades,0,1,0%,19
glenpool ok sheer roller shades,0,1,0%,19
mustang ok bamboo shades,0,1,0%,19
mustang ok draperies,0,1,0%,19
mustang ok faux wooden blinds,0,1,0%,19
nw oklahoma city ok blackout window shades,0,1,0%,19
piedmont ok cellular shade,0,1,0%,19
warr acres ok zebra roller shades,0,1,0%,19
window blinds okc,0,1,0%,19
window treatments okc,0,1,0%,19
yukon ok faux wooden blinds,0,1,0%,19
yukon ok motorized shades,0,1,0%,19
bethany ok plantation shutters,0,1,0%,20
bethany ok wood blinds,0,1,0%,20
collinsville ok motorized blinds,0,1,0%,20
coweta ok sheer fabric shades,0,1,0%,20
edmond ok blackout roman shade,0,1,0%,20
mustang ok electric blinds for windows,0,1,0%,20
mustang ok roman shades for windows,0,1,0%,20
nw oklahoma city ok blinds for windows,0,1,0%,20
nw oklahoma city ok faux wooden blinds,0,1,0%,20
nw oklahoma city ok wood shutters,0,1,0%,20
nw oklahoma city ok wooden shutters,0,1,0%,20
oklahoma city faux wood blinds,0,1,0%,20
piedmont ok mini blinds,0,1,0%,20
yukon ok custom window blinds,0,1,0%,20
yukon ok electric window blinds,0,1,0%,20
patio shades yukon ok,0,1,0%,21
piedmont ok window blind,0,1,0%,21
piedmont ok window blinds,0,1,0%,21
yukon ok blackout shades for windows,0,1,0%,21
yukon ok exterior roller shades,0,1,0%,21
yukon ok motorized retractable screens for patio,0,1,0%,21
yukon ok roller shades for windows,0,1,0%,21
bethany ok exterior shades,0,1,0%,22
bethany ok outdoor roller shades,0,1,0%,22
edmond ok wooden blinds,0,1,0%,22
mustang ok plantation shutters,0,1,0%,22
nw oklahoma city ok wooden blinds for windows,0,1,0%,22
yukon ok custom window shade,0,1,0%,22
yukon ok electric outdoor shades,0,1,0%,22
yukon ok outdoor roller shades,0,1,0%,22
yukon ok wooden window blinds,0,1,0%,22
commercial motorized shading oklahoma city,0,1,0%,23
smart home automation nichols hills,0,1,0%,23
yukon ok custom cordless blinds,0,1,0%,23
edmond ok blackout roller shades,0,1,0%,24
piedmont ok custom curtains,0,1,0%,24
hunter douglas vs graber,0,1,0%,25
"lutron shades, edmond, ok",0,1,0%,25
commercial window treatments near me,0,1,0%,26
owasso ok motorized blinds,0,1,0%,26
el reno ok motorized window shades,0,1,0%,27
graber customer service,0,1,0%,28
motorized shades near me,0,1,0%,28
window treatments near me,0,1,0%,28
norman shutters blinds shades,0,1,0%,29
graber dealers near me,0,1,0%,30
norman blinds and shades,0,1,0%,30
bethany ok sheer drapes,0,1,0%,31
el reno ok custom shades for windows,0,1,0%,31
window coverings near me,0,1,0%,34
energy efficient windows mustang,0,1,0%,39
sunrooms yukon,0,1,0%,45
smart shades near me,0,1,0%,54
how much do hunter douglas blinds cost,0,1,0%,55
hunter douglas alternative,0,1,0%,57
norman vs hunter douglas shutters,0,1,0%,57
"lutron shades, oklahoma city, ok",0,1,0%,59
smart drapes by norman,0,1,0%,59
energy‑efficient window shades gleasondale,0,1,0%,61
shade in,0,1,0%,62
blinds installation shady hollow,0,1,0%,64
alternatives to window blinds,0,1,0%,66
energy‑efficient window shades lower village,0,1,0%,70
smartdrape shades oakmont,0,1,0%,70
alternatives to blinds and curtains,0,1,0%,72
in the shade,0,1,0%,74
window blinds alternatives,0,1,0%,75
alternatives to blinds,0,1,0%,76
blinds installation saxony,0,1,0%,77
alternatives to mini blinds,0,1,0%,78
what to use instead of blinds,0,1,0%,78
alternative to window blinds,0,1,0%,79
blinds alternatives,0,1,0%,82
energy‑efficient window shades nobscot,0,1,0%,83
alternative to venetian blinds,0,1,0%,84
norman's blinds,0,1,0%,84
luxury window coverings,0,1,0%,86
graber shutter style blinds,0,1,0%,87
shaded window coverings,0,1,0%,87
energy‑efficient window shades brookside station,0,1,0%,89
blind alternative,0,1,0%,96
motorized blinds installer,0,1,0%,97
window coverings graber,0,1,0%,97
motorized blinds installers,0,1,0%,100
shade structures oklahoma city,0,1,0%,100