Top queries,Clicks,Impressions,CTR,Position
hunter douglas,1,8,12.5%,2.25
blinds oklahoma city,0,46,0%,29.48
custom blinds oklahoma city,0,26,0%,15.12
graber custom window coverings,0,23,0%,87.57
graber simple selections,0,22,0%,56.18
graber banded shades,0,22,0%,80.41
graber window shutters,0,22,0%,82.09
graber window covering,0,22,0%,85.23
window cover express okc,0,21,0%,4.71
graber plantation shutters prices,0,21,0%,69.67
graber shutters plantation,0,20,0%,72.95
graber motorized shades cost,0,20,0%,85.6
hunter douglas blinds cost,0,19,0%,59.47
graber zebra blinds,0,19,0%,90.37
premium window shades,0,18,0%,89.5
solar shades okc,0,17,0%,5.47
awning and shade companies near me,0,17,0%,50.47
graber window treatments cost,0,16,0%,84
patio shades nichols hills ok,0,15,0%,2.8
custom sun shades near me,0,15,0%,5.2
graber interior shutters,0,15,0%,73.4
custom window treatments oklahoma city,0,13,0%,12.46
patio shades edmond ok,0,13,0%,12.62
graber window products,0,13,0%,95.38
"""norman ultimate faux wood blinds"" warranty",0,12,0%,5
graber shutter blinds,0,12,0%,95.5
luxury window shades,0,12,0%,96.58
patio shades oklahoma city,0,11,0%,28.64
window shading,0,11,0%,85.09
graber shades blinds,0,11,0%,97.73
are hunter douglas blinds worth it,0,10,0%,9.6
graber shutter,0,10,0%,90.6
graber mezzanine layered zebra sheer shades,0,10,0%,94.6
patio shade installation near me,0,9,0%,10.22
outdoor patio shades north okc,0,9,0%,12.33
sunshade installation near me,0,9,0%,12.33
edmond ok motorized blackout shades,0,9,0%,12.56
custom blinds for windows oklahoma city,0,9,0%,13.56
sun shade companies near me,0,9,0%,13.67
motorized retractable shades oklahoma city,0,9,0%,16.33
sun shade installation near me,0,9,0%,20.67
outdoor shades oklahoma city,0,9,0%,21.22
window treatments,0,9,0%,49.11
blind alternatives,0,9,0%,87.56
shades in the sun,0,8,0%,2.62
outdoor shade installation near me,0,8,0%,12.38
sun shade installers near me,0,8,0%,14
custom curtains oklahoma city,0,8,0%,16.25
outdoor roller shades oklahoma city,0,8,0%,17.88
sun sail installation near me,0,8,0%,19.38
pool shade installation near me,0,8,0%,46.25
"blinds oklahoma city, ok",0,8,0%,62.12
alternative to blinds,0,8,0%,76.12
smartdrape shades greensburg,0,8,0%,96.75
oklahoma city outdoor blinds,0,7,0%,20.29
shade company,0,7,0%,24.29
motorized patio shades oklahoma city,0,7,0%,24.43
motorized porch shades oklahoma city,0,7,0%,24.43
sun shade companies,0,7,0%,28.57
hunter douglas vertical blinds cost,0,7,0%,53
sun shade awnings oklahoma city,0,7,0%,64.57
blinds and shades,0,7,0%,76.71
"blind installation oklahoma city, ok",0,7,0%,79
oakmont smartdrape shade,0,7,0%,83.14
graber solar shades pricing,0,7,0%,93.71
oakmont smart drape shade,0,7,0%,94.14
security shutters nichols hills ok,0,6,0%,5.67
warr acres ok bamboo shade,0,6,0%,8.5
sail shade installation near me,0,6,0%,11.17
shade installation near me,0,6,0%,18.67
the shade s,0,6,0%,29
norman window coverings,0,6,0%,37.67
norman shades,0,6,0%,39.67
sunrooms norman,0,6,0%,41.5
shade sail installers near me,0,6,0%,78.33
greensburg smartdrape shade,0,6,0%,95.33
are hunter douglas blinds expensive,0,5,0%,1
edmond ok zebra shade blinds,0,5,0%,10.4
nw oklahoma city ok motorized window treatments,0,5,0%,15.8
edmond ok blackout cellular shades,0,5,0%,17.2
window company edmond,0,5,0%,56.6
blinds installation near me,0,5,0%,76.8
sliding-door-window-coverings in oklahoma city,0,4,0%,6
piedmont ok zebra shade blinds,0,4,0%,8
warr acres ok motorized shades,0,4,0%,9.25
piedmont ok sheer shade,0,4,0%,10.5
warr acres ok bamboo shades,0,4,0%,10.75
warr acres ok custom mini blinds,0,4,0%,11
warr acres ok exterior roller shades,0,4,0%,11
warr acres ok custom window shade,0,4,0%,12
nw oklahoma city ok cellular shades,0,4,0%,13
piedmont ok composite shutters,0,4,0%,13.5
sunrooms edmond,0,4,0%,14.5
warr acres ok blinds for skylights,0,4,0%,14.5
edmond ok faux wood blinds,0,4,0%,15.25
mustang ok windows shutters,0,4,0%,15.75
glenpool ok sheer roman shades,0,4,0%,22
graber window treatment,0,4,0%,48.25
motorized window shades lowes,0,4,0%,49.25
energy efficient windows norman,0,4,0%,49.75
energy efficient windows edmond,0,4,0%,52.5
graber shutter colors,0,4,0%,52.75
smartdrape shades nearby,0,4,0%,84.25
graber roller shades pricing,0,4,0%,95
luxury shading company,0,4,0%,96
edmond ok motorized shades,0,3,0%,3
edmond ok electric blinds for windows,0,3,0%,4.67
warr acres ok windows shutters,0,3,0%,5
oklahoma city motorized blinds,0,3,0%,5.67
warr acres ok roman shade,0,3,0%,6
is hunter douglas worth it,0,3,0%,6.33
bethany ok motorized shades,0,3,0%,8
custom shades edmond,0,3,0%,8
window treatment oklahoma city,0,3,0%,8
edmond custom blinds and shades,0,3,0%,9
oklahoma city cellular shades,0,3,0%,9
oklahoma city window treatments,0,3,0%,9.33
edmond custom window coverings,0,3,0%,10
edmond custom window treatments,0,3,0%,10.33
edmond window treatments,0,3,0%,10.33
yukon ok zebra shade blinds,0,3,0%,10.67
blinds edmond,0,3,0%,12.33
custom blinds edmond,0,3,0%,12.33
window covering edmond,0,3,0%,12.33
oklahoma city office blinds,0,3,0%,12.67
window covering oklahoma city,0,3,0%,12.67
nw oklahoma city ok motorized exterior shades,0,3,0%,13
warr acres ok blackout roller shades,0,3,0%,13
oklahoma city motorized shades,0,3,0%,13.33
oklahoma city roman shades,0,3,0%,13.33
edmond window coverings,0,3,0%,14
oklahoma city custom window treatments,0,3,0%,14
piedmont ok blackout roman shade,0,3,0%,14
warr acres ok motorized window treatments,0,3,0%,14
oklahoma city window coverings,0,3,0%,14.33
warr acres ok motorized outdoor shades,0,3,0%,14.33
nw oklahoma city ok outdoor motorized shades,0,3,0%,15
oklahoma city custom blinds and shades,0,3,0%,15.33
edmond ok bamboo window shades,0,3,0%,15.67
oklahoma city custom blinds,0,3,0%,15.67
nw oklahoma city ok electric blinds,0,3,0%,16
oklahoma city commercial blinds,0,3,0%,16
mustang ok drapery,0,3,0%,16.67
oklahoma city custom window coverings,0,3,0%,18.33
oklahoma city plantation shutters,0,3,0%,18.33
edmond ok wooden blinds for windows,0,3,0%,19
nw oklahoma city ok house shutters,0,3,0%,19
nw oklahoma city ok custom mini blinds,0,3,0%,19.33
oklahoma city wood blinds,0,3,0%,19.67
norman shades and blinds,0,3,0%,32.67
graber blinds near me,0,3,0%,41
hunter douglas pricing,0,3,0%,41.67
sunrooms oklahoma city,0,3,0%,48.33
hunter douglas cost,0,3,0%,54.33
graber custom window treatments,0,3,0%,55.67
premium shades,0,3,0%,57.67
motorized interior shutters oakmont,0,3,0%,70
hunter douglas blinds quality,0,3,0%,77.67
luxury blinds,0,2,0%,1
window shades designer,0,2,0%,1
high quality blinds,0,2,0%,1.5
high quality window shades,0,2,0%,1.5
high quality roman shades,0,2,0%,2
window coverings manufacturers,0,2,0%,2
high end window shades,0,2,0%,2.5
edmond ok zebra roller shades,0,2,0%,3
hunter douglas malaysia,0,2,0%,3
warr acres ok custom window blinds,0,2,0%,3.5
shade and blinds,0,2,0%,5
warr acres ok window blinds,0,2,0%,6
shades,0,2,0%,6.5
warr acres ok motorized blackout shades,0,2,0%,6.5
edmond ok sheer roman shades,0,2,0%,7
warr acres ok sheer shades,0,2,0%,7
warr acres ok sheer window shades,0,2,0%,7
warr acres ok motorized window shades,0,2,0%,7.5
warr acres ok motorized window treatment,0,2,0%,7.5
warr acres ok blinds mini blinds,0,2,0%,8
warr acres ok cellular shade,0,2,0%,8
warr acres ok skylight blinds,0,2,0%,8
bethany ok zebra shade blinds,0,2,0%,8.5
piedmont ok motorized blackout shades,0,2,0%,8.5
warr acres ok blackout shades,0,2,0%,8.5
warr acres ok composite shutters,0,2,0%,8.5
warr acres ok cordless blinds for windows,0,2,0%,8.5
edmond ok custom mini blinds,0,2,0%,9
patio shades piedmont ok,0,2,0%,9
piedmont ok motorized window shades,0,2,0%,9
warr acres ok roman shades,0,2,0%,9
warr acres ok sheer shade,0,2,0%,9
blinds and shade,0,2,0%,9.5
piedmont ok cordless blinds,0,2,0%,9.5
piedmont ok motorized window treatment,0,2,0%,9.5
piedmont ok sheer shades,0,2,0%,9.5
warr acres ok blackout roman shades,0,2,0%,9.5
warr acres ok drapery,0,2,0%,9.5
warr acres ok drapes,0,2,0%,9.5
warr acres ok window shutters,0,2,0%,9.5
bethany ok motorized window treatment,0,2,0%,10
piedmont ok motorized window treatments,0,2,0%,10
warr acres ok custom blind,0,2,0%,10
warr acres ok motorized exterior shades,0,2,0%,10
warr acres ok roller shade,0,2,0%,10
bethany ok sheer roller shades,0,2,0%,10.5
bethany ok sheer roman shades,0,2,0%,10.5
edmond ok zebra shades,0,2,0%,10.5
warr acres ok custom cordless blinds,0,2,0%,10.5
warr acres ok shutters,0,2,0%,10.5
warr acres ok wooden shutters,0,2,0%,10.5
bethany ok roman shade,0,2,0%,11
edmond ok exterior roller shades,0,2,0%,11
nw oklahoma city ok electric blinds for windows,0,2,0%,11
outdoor sun shade installation near me,0,2,0%,11
piedmont ok automatic blinds,0,2,0%,11
piedmont ok drapery,0,2,0%,11
piedmont ok sheer roller shades,0,2,0%,11
piedmont ok zebra roller shades,0,2,0%,11
warr acres ok curtains,0,2,0%,11
warr acres ok custom drapery,0,2,0%,11
warr acres ok custom window shades,0,2,0%,11
warr acres ok draperies,0,2,0%,11
warr acres ok roller shades for windows,0,2,0%,11
warr acres ok sheer roller shades,0,2,0%,11
warr acres ok vertical cellular shades,0,2,0%,11
custom blinds installation edmond,0,2,0%,11.5
piedmont ok cellular shades,0,2,0%,11.5
piedmont ok roman shades blackout,0,2,0%,11.5
warr acres ok custom draperies,0,2,0%,11.5
warr acres ok interior plantation shutters,0,2,0%,11.5
edmond ok custom blinds,0,2,0%,12
edmond ok motorized outdoor shades,0,2,0%,12
mustang ok sheer shades,0,2,0%,12
piedmont ok motorized exterior shades,0,2,0%,12
warr acres ok electric window blinds,0,2,0%,12
warr acres ok exterior shades,0,2,0%,12
bethany ok exterior window shades,0,2,0%,12.5
edmond ok blackout shade,0,2,0%,12.5
edmond ok motorized window shades,0,2,0%,12.5
edmond ok window curtains,0,2,0%,12.5
mustang ok sheer draperies,0,2,0%,12.5
piedmont ok electric window blinds,0,2,0%,12.5
warr acres ok automatic blinds,0,2,0%,12.5
warr acres ok electric blinds for windows,0,2,0%,12.5
warr acres ok exterior window shades,0,2,0%,12.5
bethany ok zebra shades,0,2,0%,13
mustang ok wood blinds,0,2,0%,13
nw oklahoma city ok custom window shade,0,2,0%,13
oklahoma city roller shades,0,2,0%,13
warr acres ok cellular shades,0,2,0%,13
warr acres ok outdoor motorized shades,0,2,0%,13
warr acres ok roman shades for windows,0,2,0%,13
bethany ok electric blinds for windows,0,2,0%,13.5
edmond ok mini blinds,0,2,0%,13.5
edmond ok motorized window treatments,0,2,0%,13.5
edmond ok outdoor roller shades,0,2,0%,13.5
mustang ok motorized window shades,0,2,0%,13.5
mustang ok wooden shutters,0,2,0%,13.5
mustang ok zebra shade blinds,0,2,0%,13.5
nw oklahoma city ok motorized window treatment,0,2,0%,13.5
piedmont ok sheer window shades,0,2,0%,13.5
warr acres ok outdoor roller shades,0,2,0%,13.5
warr acres ok roller window shades,0,2,0%,13.5
collinsville ok electric blinds,0,2,0%,14
edmond ok blinds for windows cordless,0,2,0%,14
edmond ok exterior shades,0,2,0%,14
mustang ok sheer roller shades,0,2,0%,14
warr acres ok blackout window shades,0,2,0%,14
warr acres ok wooden blinds,0,2,0%,14
bethany ok motorized window treatments,0,2,0%,14.5
edmond ok motorized exterior shades,0,2,0%,14.5
edmond ok sheer shades,0,2,0%,14.5
warr acres ok electric outdoor shades,0,2,0%,14.5
bethany ok custom cordless blinds,0,2,0%,15
bethany ok sheer fabric shades,0,2,0%,15
bethany ok sheer shades,0,2,0%,15
edmond ok vertical cellular shades,0,2,0%,15
edmond ok window blind,0,2,0%,15
piedmont ok plantation shutters,0,2,0%,15
piedmont ok sheer roman shades,0,2,0%,15
warr acres ok blackout shade,0,2,0%,15
warr acres ok custom drapes,0,2,0%,15
bethany ok cellular window shades,0,2,0%,15.5
edmond ok cellular shade,0,2,0%,15.5
edmond ok cellular window shades,0,2,0%,15.5
edmond ok window shutters,0,2,0%,15.5
mustang ok sheer window shades,0,2,0%,15.5
piedmont ok roller shade,0,2,0%,15.5
piedmont ok roman shade,0,2,0%,15.5
warr acres ok blinds for windows,0,2,0%,15.5
yukon ok motorized blackout shades,0,2,0%,15.5
bethany ok exterior motorized shades,0,2,0%,16
city shade,0,2,0%,16
edmond ok outdoor motorized shades,0,2,0%,16
mustang ok sheer roman shades,0,2,0%,16
edmond ok automatic blinds,0,2,0%,16.5
edmond ok cellular shades,0,2,0%,16.5
warr acres ok outdoor shades for patio,0,2,0%,16.5
bethany ok wooden shutters,0,2,0%,17
edmond ok sheer window shades,0,2,0%,17
piedmont ok outdoor motorized shades,0,2,0%,17.5
"automatic blinds edmond, ok",0,2,0%,19
blinds near me,0,2,0%,19.5
motorized blinds near me,0,2,0%,20
nw oklahoma city ok roman shade,0,2,0%,21
nw oklahoma city ok window shutters,0,2,0%,21
sapulpa ok sheer fabric shades,0,2,0%,21
nw oklahoma city ok interior plantation shutters,0,2,0%,21.5
nw oklahoma city ok exterior window shades,0,2,0%,22
nw oklahoma city ok faux wood blinds,0,2,0%,22.5
nw oklahoma city ok sheer shades,0,2,0%,22.5
mustang ok roman shades,0,2,0%,24
graber vs hunter douglas,0,2,0%,24.5
norman window shades,0,2,0%,27.5
"motorized blinds oklahoma city, ok",0,2,0%,28
norman smart home solutions,0,2,0%,28
energy‑efficient window shades ayres city,0,2,0%,31
sun shade near me,0,2,0%,31.5
graber blinds customer service,0,2,0%,34
motorized shades oklahoma city,0,2,0%,36
custom sunrooms buxton,0,2,0%,45
energy‑efficient window shades havenville,0,2,0%,55.5
smart home installation norman ok,0,2,0%,57
sunroom oklahoma city,0,2,0%,59.5
window blind alternatives,0,2,0%,76.5
energy‑efficient window shades south village,0,2,0%,77.5
graber blinds and shades,0,2,0%,85.5
window shutters sun city,0,2,0%,88.5
energy-efficient window installation oklahoma city,0,2,0%,92.5
window treatment alternatives,0,2,0%,93
custom window treatments,0,2,0%,99
best blind brands,0,1,0%,1
best online blinds company,0,1,0%,1
blind brands,0,1,0%,1
custom blinds company viera,0,1,0%,1
designer window coverings,0,1,0%,1
high end window blinds,0,1,0%,1
hunter douglas blinds online,0,1,0%,1
hunter douglas company,0,1,0%,1
hunter douglas complaints,0,1,0%,1
hunter douglas lake jackson tx,0,1,0%,1
hunter douglas shutters cost,0,1,0%,1
hunter douglas staunton va,0,1,0%,1
is hunter douglas a good brand,0,1,0%,1
is hunter douglas blinds expensive,0,1,0%,1
luxury roller shades,0,1,0%,1
media shades,0,1,0%,1
new blind,0,1,0%,1
quality roller shades,0,1,0%,1
shades cartersville ga,0,1,0%,1
sun and shade,0,1,0%,1
warr acres ok roller shades,0,1,0%,1
window blinds salt lake city utah,0,1,0%,1
window covering suppliers,0,1,0%,1
window treatment company,0,1,0%,1
douglas blinds,0,1,0%,2
dripping springs window shades,0,1,0%,2
hunter blinds,0,1,0%,2
hunter douglas canada,0,1,0%,2
hunter douglas duette honeycomb shades,0,1,0%,2
hunter douglas motorized blinds,0,1,0%,2
hunter douglas showroom,0,1,0%,2
la custom blinds reviews,0,1,0%,2
plantation shutters vero beach,0,1,0%,2
premium roller shades,0,1,0%,2
shade store,0,1,0%,2
stores hunter douglas,0,1,0%,2
sunnshade,0,1,0%,2
the shade store,0,1,0%,2
warr acres ok blinds for windows cordless,0,1,0%,2
warr acres ok cordless blinds,0,1,0%,2
warr acres ok exterior motorized shades,0,1,0%,2
warr acres ok sheer draperies,0,1,0%,2
warr acres ok sheer roman shades,0,1,0%,2
warr acres ok zebra shade blinds,0,1,0%,2
why are they so expensive,0,1,0%,2
window binders,0,1,0%,2
window blinds manufacturers,0,1,0%,2
best blinds for windows,0,1,0%,3
best hurricane shutters,0,1,0%,3
edmond ok motorized window treatment,0,1,0%,3
how much are hunter douglas blinds,0,1,0%,3
hunter douglas dealer legacy calgary t2x in-home consultation,0,1,0%,3
hunter douglas vignette roman shades price,0,1,0%,3
warr acres ok cellular window shades,0,1,0%,3
warr acres ok cordless window blinds,0,1,0%,3
warr acres ok custom blinds,0,1,0%,3
warr acres ok custom shades for windows,0,1,0%,3
warr acres ok motorized blinds,0,1,0%,3
warr acres ok roman shades blackout,0,1,0%,3
warr acres ok sheer fabric shades,0,1,0%,3
warr acres ok zebra shades,0,1,0%,3
edmond ok motorized blinds,0,1,0%,4
hunter douglas chennai,0,1,0%,4
hunter douglas.,0,1,0%,4
huntet douglas,0,1,0%,4
"motorized window shades, edmond, ok",0,1,0%,4
piedmont ok zebra shades,0,1,0%,4
warr acres ok blackout roman shade,0,1,0%,4
warr acres ok blinds,0,1,0%,4
warr acres ok outdoor shades,0,1,0%,4
warr acres ok wood blinds,0,1,0%,4
warr acres ok wooden blinds for windows,0,1,0%,4
bethany ok zebra roller shades,0,1,0%,5
edmond ok electric window blinds,0,1,0%,5
piedmont ok sheer drapes,0,1,0%,5
piedmont ok wooden shutters,0,1,0%,5
warr acres ok custom curtains,0,1,0%,5
warr acres ok electric blinds,0,1,0%,5
warr acres ok shutters for windows,0,1,0%,5
warr acres ok window blind,0,1,0%,5
warr acres ok window curtains,0,1,0%,5
warr acres ok wooden window blinds,0,1,0%,5
bethany ok roller window shades,0,1,0%,6
edmond ok cordless window blinds,0,1,0%,6
edmond ok electric blinds,0,1,0%,6
edmond ok roller shades,0,1,0%,6
edmond ok sheer roller shades,0,1,0%,6
piedmont ok cellular window shades,0,1,0%,6
piedmont ok custom blind,0,1,0%,6
piedmont ok sheer fabric shades,0,1,0%,6
warr acres ok blackout shades for windows,0,1,0%,6
warr acres ok wood shutters,0,1,0%,6
windowsandgarden,0,1,0%,6
bethany ok sheer draperies,0,1,0%,7
different shades of purple,0,1,0%,7
edmond ok exterior motorized shades,0,1,0%,7
edmond ok roman shade,0,1,0%,7
edmond ok sheer fabric shades,0,1,0%,7
piedmont ok custom window shade,0,1,0%,7
piedmont ok motorized blinds,0,1,0%,7
piedmont ok roller window shades,0,1,0%,7
piedmont ok sheer draperies,0,1,0%,7
warr acres ok faux wood blinds,0,1,0%,7
warr acres ok house shutters,0,1,0%,7
warr acres ok shutter repair,0,1,0%,7
bethany ok cordless window blinds,0,1,0%,8
bethany ok motorized blackout shades,0,1,0%,8
edmond ok blackout shades,0,1,0%,8
edmond ok custom window shade,0,1,0%,8
edmond ok electric outdoor shades,0,1,0%,8
edmond ok roller shade,0,1,0%,8
edmond ok roller window shades,0,1,0%,8
made in a shade,0,1,0%,8
piedmont ok electric blinds,0,1,0%,8
piedmont ok motorized shades,0,1,0%,8
warr acres ok custom curtain,0,1,0%,8
warr acres ok faux wooden blinds,0,1,0%,8
window treatments hampstead,0,1,0%,8
bethany ok exterior roller shades,0,1,0%,9
edmond ok roman shades,0,1,0%,9
edmond ok sheer shade,0,1,0%,9
hunter douglas latest,0,1,0%,9
nw oklahoma city ok electric window blinds,0,1,0%,9
piedmont ok custom cordless blinds,0,1,0%,9
warr acres ok plantation shutters,0,1,0%,9
yukon ok zebra shades,0,1,0%,9
bethany ok blinds for windows cordless,0,1,0%,10
bethany ok composite shutters,0,1,0%,10
bethany ok custom window shade,0,1,0%,10
commercial shading systems,0,1,0%,10
mustang ok blackout roman shades,0,1,0%,10
mustang ok composite shutters,0,1,0%,10
mustang ok motorized shades,0,1,0%,10
nw oklahoma city ok roller window shades,0,1,0%,10
warr acres ok bamboo window shades,0,1,0%,10
who sells window blinds near me,0,1,0%,10
are hunter douglas shades expensive,0,1,0%,11
bethany ok bamboo shades,0,1,0%,11
bethany ok roller shades,0,1,0%,11
bethany ok wood shutters,0,1,0%,11
custom shades yukon,0,1,0%,11
edmond ok custom blind,0,1,0%,11
edmond ok custom shades for windows,0,1,0%,11
edmond ok custom window blinds,0,1,0%,11
edmond ok custom window shades,0,1,0%,11
edmond ok roman shades for windows,0,1,0%,11
mustang ok motorized window treatments,0,1,0%,11
mustang ok roller window shades,0,1,0%,11
mustang ok sheer shade,0,1,0%,11
nw oklahoma city ok exterior motorized shades,0,1,0%,11
nw oklahoma city ok motorized shades,0,1,0%,11
nw oklahoma city ok sheer roller shades,0,1,0%,11
piedmont ok blackout shade,0,1,0%,11
piedmont ok blackout shades,0,1,0%,11
piedmont ok custom window shades,0,1,0%,11
piedmont ok electric blinds for windows,0,1,0%,11
piedmont ok exterior window shades,0,1,0%,11
piedmont ok outdoor shades,0,1,0%,11
piedmont ok roller shades,0,1,0%,11
piedmont ok roman shades,0,1,0%,11
sapulpa ok automatic blinds,0,1,0%,11
shutter and blind,0,1,0%,11
window blinds and shutters near me,0,1,0%,11
yukon ok roman shade,0,1,0%,11
yukon ok sheer roman shades,0,1,0%,11
bethany ok blackout roman shade,0,1,0%,12
bethany ok blackout shades,0,1,0%,12
bethany ok blackout window shades,0,1,0%,12
bethany ok custom window blinds,0,1,0%,12
edmond ok bamboo shade,0,1,0%,12
edmond ok windows shutters,0,1,0%,12
edmond ok wood blinds,0,1,0%,12
edmond ok wood shutters,0,1,0%,12
edmond ok wooden shutters,0,1,0%,12
edmond ok wooden window blinds,0,1,0%,12
is hunter douglas expensive,0,1,0%,12
mustang ok automatic blinds,0,1,0%,12
mustang ok cellular shades,0,1,0%,12
mustang ok custom window shade,0,1,0%,12
mustang ok interior plantation shutters,0,1,0%,12
mustang ok motorized window treatment,0,1,0%,12
mustang ok sheer fabric shades,0,1,0%,12
nw oklahoma city ok motorized blinds,0,1,0%,12
piedmont ok bamboo shades,0,1,0%,12
piedmont ok blackout roman shades,0,1,0%,12
piedmont ok blackout shades for windows,0,1,0%,12
piedmont ok blackout window shades,0,1,0%,12
piedmont ok interior plantation shutters,0,1,0%,12
piedmont ok shutters for windows,0,1,0%,12
roller blinds near me,0,1,0%,12
warr acres ok mini blinds,0,1,0%,12
yukon ok motorized window treatment,0,1,0%,12
yukon ok motorized window treatments,0,1,0%,12
yukon ok sheer roller shades,0,1,0%,12
yukon ok sheer shade,0,1,0%,12
yukon ok sheer shades,0,1,0%,12
yukon ok sheer window shades,0,1,0%,12
bethany ok automatic blinds,0,1,0%,13
bethany ok blackout roman shades,0,1,0%,13
bethany ok sheer shade,0,1,0%,13
bethany ok wooden window blinds,0,1,0%,13
edmond ok bamboo shades,0,1,0%,13
edmond ok blackout shades for windows,0,1,0%,13
edmond ok composite shutters,0,1,0%,13
edmond ok custom cordless blinds,0,1,0%,13
edmond ok outdoor shades for patio,0,1,0%,13
edmond ok sheer draperies,0,1,0%,13
mustang ok blackout roman shade,0,1,0%,13
mustang ok electric blinds,0,1,0%,13
mustang ok exterior window shades,0,1,0%,13
nw oklahoma city ok blackout roman shades,0,1,0%,13
nw oklahoma city ok blackout shade,0,1,0%,13
nw oklahoma city ok cellular window shades,0,1,0%,13
nw oklahoma city ok motorized blackout shades,0,1,0%,13
nw oklahoma city ok motorized outdoor shades,0,1,0%,13
nw oklahoma city ok roller shade,0,1,0%,13
nw oklahoma city ok wooden blinds,0,1,0%,13
piedmont ok blackout roller shades,0,1,0%,13
piedmont ok custom window blinds,0,1,0%,13
piedmont ok faux wood blinds,0,1,0%,13
piedmont ok roller shades blackout,0,1,0%,13
piedmont ok roman shades for windows,0,1,0%,13
piedmont ok skylight blinds,0,1,0%,13
piedmont ok window curtains,0,1,0%,13
yukon ok roman shades,0,1,0%,13
yukon ok wood shutters,0,1,0%,13
bethany ok blackout roller shades,0,1,0%,14
bethany ok cordless blinds,0,1,0%,14
bethany ok cordless blinds for windows,0,1,0%,14
bethany ok electric outdoor shades,0,1,0%,14
bethany ok motorized blinds,0,1,0%,14
bethany ok roller shades for windows,0,1,0%,14
bethany ok roman shades for windows,0,1,0%,14
bethany ok sheer window shades,0,1,0%,14
collinsville ok motorized window shades,0,1,0%,14
edmond ok faux wooden blinds,0,1,0%,14
edmond ok skylight blinds,0,1,0%,14
mustang ok electric window blinds,0,1,0%,14
mustang ok motorized blackout shades,0,1,0%,14
nw oklahoma city ok blackout roman shade,0,1,0%,14
nw oklahoma city ok custom blinds,0,1,0%,14
nw oklahoma city ok custom window shades,0,1,0%,14
nw oklahoma city ok electric outdoor shades,0,1,0%,14
nw oklahoma city ok roller shades for windows,0,1,0%,14
nw oklahoma city ok roman shades for windows,0,1,0%,14
nw oklahoma city ok sheer shade,0,1,0%,14
piedmont ok custom draperies,0,1,0%,14
piedmont ok custom mini blinds,0,1,0%,14
piedmont ok custom shades for windows,0,1,0%,14
piedmont ok exterior roller shades,0,1,0%,14
piedmont ok roller shades for windows,0,1,0%,14
piedmont ok wooden blinds for windows,0,1,0%,14
piedmont ok wooden window blinds,0,1,0%,14
sapulpa ok motorized blackout shades,0,1,0%,14
warr acres ok blinds repair,0,1,0%,14
yukon ok roman shades for windows,0,1,0%,14
bethany ok electric blinds,0,1,0%,15
bethany ok electric window blinds,0,1,0%,15
bethany ok roller shade,0,1,0%,15
bethany ok window shutters,0,1,0%,15
coweta ok motorized window treatment,0,1,0%,15
edmond ok blinds mini blinds,0,1,0%,15
edmond ok cordless blinds for windows,0,1,0%,15
edmond ok exterior window shades,0,1,0%,15
edmond ok house shutters,0,1,0%,15
edmond ok shutters for windows,0,1,0%,15
edmond ok window blinds,0,1,0%,15
mustang ok blackout window shades,0,1,0%,15
mustang ok custom window shades,0,1,0%,15
mustang ok motorized blinds,0,1,0%,15
mustang ok wooden blinds,0,1,0%,15
mustang ok wooden window blinds,0,1,0%,15
mustang ok zebra shades,0,1,0%,15
nw oklahoma city ok automatic blinds,0,1,0%,15
nw oklahoma city ok blinds for windows cordless,0,1,0%,15
nw oklahoma city ok custom cordless blinds,0,1,0%,15
nw oklahoma city ok custom window blinds,0,1,0%,15
nw oklahoma city ok motorized window shades,0,1,0%,15
nw oklahoma city ok roller shades,0,1,0%,15
nw oklahoma city ok sheer roman shades,0,1,0%,15
shades for sun,0,1,0%,15
yukon ok cellular window shades,0,1,0%,15
yukon ok roller window shades,0,1,0%,15
yukon ok sheer fabric shades,0,1,0%,15
bethany ok blackout shades for windows,0,1,0%,16
bethany ok custom window shades,0,1,0%,16
bethany ok motorized window shades,0,1,0%,16
bethany ok shutters,0,1,0%,16
coweta ok motorized window treatments,0,1,0%,16
edmond ok blackout window shades,0,1,0%,16
edmond ok blinds,0,1,0%,16
edmond ok blinds for skylights,0,1,0%,16
edmond ok blinds for windows,0,1,0%,16
edmond ok outdoor shades,0,1,0%,16
edmond ok roller shades for windows,0,1,0%,16
mustang ok blackout shades,0,1,0%,16
mustang ok custom mini blinds,0,1,0%,16
mustang ok custom shades for windows,0,1,0%,16
mustang ok shutters for windows,0,1,0%,16
mustang ok window shutters,0,1,0%,16
nw oklahoma city ok composite shutters,0,1,0%,16
nw oklahoma city ok roman shades,0,1,0%,16
nw oklahoma city ok sheer window shades,0,1,0%,16
piedmont ok house shutters,0,1,0%,16
sapulpa ok motorized window treatments,0,1,0%,16
yukon ok exterior window shades,0,1,0%,16
bethany ok custom blinds,0,1,0%,17
