Top queries,Clicks,Impressions,CTR,Position
blinds oklahoma city,0,31,0%,15.71
graber banded shades,0,22,0%,59.95
patio shades nichols hills ok,0,21,0%,2.86
custom blinds oklahoma city,0,16,0%,16.25
graber zebra blinds,0,16,0%,66.75
graber shutters plantation,0,15,0%,64.4
solar shades okc,0,14,0%,4.21
sun shade installers near me,0,13,0%,15.08
graber promotions,0,13,0%,73.15
graber vertical blinds colors,0,13,0%,77.77
outdoor patio shades north okc,0,12,0%,16.33
awning and shade companies near me,0,12,0%,88.33
what are the 3 levels of light blocking translucent,0,12,0%,95.5
are hunter douglas blinds expensive,0,11,0%,12.73
sun shade company,0,10,0%,3.9
coweta ok sheer roller shades,0,10,0%,19.6
motorized retractable shades oklahoma city,0,10,0%,22.6
patio shades oklahoma city,0,10,0%,30.1
graber simple selections,0,10,0%,42.6
alternative to blinds,0,10,0%,71.1
zebra shades oklahoma city,0,9,0%,2.78
custom sun shades near me,0,9,0%,4.33
is hunter douglas expensive,0,9,0%,7.44
custom blinds north okc,0,9,0%,8.22
outdoor sun shade installation near me,0,9,0%,12.78
shade installation near me,0,9,0%,20.56
shade company,0,9,0%,32.56
patio shades edmond ok,0,9,0%,37.78
energy-efficient shades north okc,0,8,0%,5.88
roller shades oklahoma city,0,8,0%,10.88
outdoor roller shades oklahoma city,0,8,0%,12.38
custom window treatments oklahoma city,0,8,0%,12.5
sun shade installation near me,0,8,0%,13.62
sun shade companies near me,0,8,0%,14.25
sunshade installation near me,0,8,0%,16.38
outdoor shade installation near me,0,8,0%,21.75
oklahoma city outdoor blinds,0,8,0%,22.12
outdoor shades oklahoma city,0,8,0%,25.38
"blinds oklahoma city, ok",0,8,0%,64.12
graber motorized shades cost,0,8,0%,93.25
graber window products,0,8,0%,96
security shutters nichols hills ok,0,7,0%,8.14
patio shades mustang ok,0,7,0%,9.71
patio shades piedmont ok,0,7,0%,9.71
cellular shades north okc,0,7,0%,10.14
custom blinds okc,0,7,0%,12.57
custom curtains oklahoma city,0,7,0%,12.86
custom curtains and drapes oklahoma city,0,7,0%,14.14
custom blinds for windows oklahoma city,0,7,0%,15.57
patio shade installation near me,0,7,0%,16.57
motorized porch shades oklahoma city,0,7,0%,25.43
sun shade awnings oklahoma city,0,7,0%,67.14
motorized patio shades oklahoma city,0,7,0%,70.14
"blind installation oklahoma city, ok",0,7,0%,82.14
blackout shades north oklahoma city,0,6,0%,11.33
roman shades okc,0,6,0%,11.83
patio shades oklahoma city ok,0,6,0%,83.83
sun sail installation near me,0,5,0%,25.8
shade sail installers near me,0,5,0%,31.2
store hunter douglas prix,0,4,0%,4
why are hunter douglas blinds so expensive,0,4,0%,5.5
sliding-door-window-coverings in oklahoma city,0,4,0%,7
window shades north oklahoma city,0,4,0%,12
blinds near me,0,4,0%,13.75
sunrooms edmond,0,4,0%,28.25
"automatic blinds edmond, ok",0,4,0%,30.5
"motorized blinds oklahoma city, ok",0,4,0%,40.25
graber mezzanine layered zebra sheer shades,0,4,0%,72
woodlore shutters dealer,0,4,0%,79.25
sheer window shades oakmont,0,4,0%,97.75
the shade store,0,3,0%,2
hunter douglas,0,3,0%,2.33
shades in the sun,0,3,0%,3
automated window shades north okc,0,3,0%,7.33
custom blinds edmond,0,3,0%,8
edmond window treatments,0,3,0%,10.33
oklahoma city roman shades,0,3,0%,14.33
oklahoma city window coverings,0,3,0%,15.67
sunshade installers near me,0,3,0%,17.33
shade sail company near me,0,3,0%,23
are hunter douglas blinds worth it,0,3,0%,45.67
sunrooms oklahoma city,0,3,0%,50.67
patio shades yukon ok,0,3,0%,97
award-winning blinds and shutters,0,2,0%,1
high end blinds,0,2,0%,2.5
hunter douglas india,0,2,0%,2.5
custom shades edmond,0,2,0%,5
motorized shade installation,0,2,0%,5
why is hunter douglas so expensive?,0,2,0%,5
edmond custom blinds and shades,0,2,0%,7
oklahoma city cellular shades,0,2,0%,9.5
edmond custom window treatments,0,2,0%,10
edmond custom window coverings,0,2,0%,10.5
window treatment oklahoma city,0,2,0%,10.5
edmond window coverings,0,2,0%,11
oklahoma city window treatments,0,2,0%,11
sail shade installation near me,0,2,0%,11
custom blinds installation edmond,0,2,0%,11.5
window covering edmond,0,2,0%,12
oklahoma city office blinds,0,2,0%,12.5
blinds edmond,0,2,0%,13
oklahoma city commercial blinds,0,2,0%,13.5
oklahoma city custom window treatments,0,2,0%,14
coweta ok motorized window treatment,0,2,0%,14.5
oklahoma city motorized blinds,0,2,0%,14.5
window covering oklahoma city,0,2,0%,14.5
oklahoma city custom window coverings,0,2,0%,15.5
oklahoma city motorized shades,0,2,0%,16.5
oklahoma city custom blinds and shades,0,2,0%,17.5
oklahoma city wood blinds,0,2,0%,18
custom drapes oklahoma city,0,2,0%,18.5
oklahoma city custom blinds,0,2,0%,19
motorized shades oklahoma city,0,2,0%,19.5
motorized blinds near me,0,2,0%,20.5
plantation shutters oklahoma city,0,2,0%,26
"automated blinds oklahoma city, ok",0,2,0%,29
energy efficient windows norman,0,2,0%,42
blind alternatives,0,2,0%,45.5
energy efficient windows edmond,0,2,0%,52.5
window blinds near me,0,2,0%,59.5
custom shades fort hancock,0,2,0%,60.5
local shade,0,2,0%,66.5
sunroom oklahoma city,0,2,0%,73.5
alternatives to blinds,0,2,0%,81
high end window shades,0,1,0%,1
hunter douglas blinds price,0,1,0%,1
hunter douglas prices,0,1,0%,1
hunter douglas shutters cost,0,1,0%,1
select blinds hunter douglas,0,1,0%,1
"""hunter douglas"" walden calgary",0,1,0%,2
dynamodecor.hunterdouglas.ca consultation,0,1,0%,2
hunter douglas españa,0,1,0%,2
hunter douglas europe bv,0,1,0%,2
hunter douglas india price,0,1,0%,2
hunter douglas persianas precio,0,1,0%,2
high end window blinds,0,1,0%,3
hunter douglas malaysia,0,1,0%,3
hunter douglas malaysia (hq & showroom) photos,0,1,0%,3
made in the shade window treatments,0,1,0%,3
douglas curtains,0,1,0%,4
douglas hunter,0,1,0%,4
pirouette shades,0,1,0%,4
solar shades for windows near me,0,1,0%,5
graber blinds near me,0,1,0%,6
made in the shade,0,1,0%,6
"motorized window shades, edmond, ok",0,1,0%,6
sparkle blinds,0,1,0%,6
blind store near me,0,1,0%,7
commercial window shades,0,1,0%,7
motorized window treatments near me,0,1,0%,7
piedmont ok sheer window shades,0,1,0%,7
vertical blinds north okc,0,1,0%,8
had i not seen the sun,0,1,0%,9
are hunter douglas shades expensive,0,1,0%,10
custom roman shades near me,0,1,0%,10
custom window treatments near me,0,1,0%,10
warr acres ok curtains,0,1,0%,10
custom window treatment,0,1,0%,11
edmond ok automatic blinds,0,1,0%,11
blinds for every style and room near me,0,1,0%,12
nw oklahoma city ok roman shades,0,1,0%,12
plantation shutters north okc,0,1,0%,12
sun shade,0,1,0%,12
custom window coverings near me,0,1,0%,13
is hunter douglas blinds expensive,0,1,0%,13
lighting control nichols hills,0,1,0%,13
oklahoma city roller shades,0,1,0%,13
roller shades open near me,0,1,0%,14
custom window treatments yukon,0,1,0%,15
glenpool ok motorized window shades,0,1,0%,15
motorized shades near me,0,1,0%,15
window blinds and shutters near me,0,1,0%,15
curtain installation oklahoma city,0,1,0%,16
oklahoma city plantation shutters,0,1,0%,16
edmond ok blinds mini blinds,0,1,0%,18
nw oklahoma city ok sheer shades,0,1,0%,18
oklahoma city faux wood blinds,0,1,0%,19
blinds installation near me,0,1,0%,20
oklahoma city outdoor shades,0,1,0%,20
blinds company near me,0,1,0%,21
city shade,0,1,0%,21
custom blinds near me,0,1,0%,23
sunrooms mustang,0,1,0%,27
alternative to window blinds,0,1,0%,29
"lutron shades edmond, ok",0,1,0%,29
window treatment fairfield,0,1,0%,29
"lutron shades, edmond, ok",0,1,0%,30
window coverings near me,0,1,0%,30
graber customer service,0,1,0%,32
oklahoma sunrooms,0,1,0%,39
sunrooms norman,0,1,0%,44
"motorized shades ogunquit, me",0,1,0%,47
graber window blinds dealership,0,1,0%,49
sunrooms nicholson,0,1,0%,50
roller shades installers briar,0,1,0%,54
smart shades near me,0,1,0%,57
sunroom addition edmond,0,1,0%,57
graber interior shutters,0,1,0%,58
"motorized shades granger, in",0,1,0%,58
commercial motorized shading oklahoma city,0,1,0%,70
"lutron shades oklahoma city, ok",0,1,0%,71
window blinds alternatives,0,1,0%,72
window shades installation excelsior,0,1,0%,72
"lutron shades, oklahoma city, ok",0,1,0%,83
sunroom addition edmond ok,0,1,0%,83
under the sun okc,0,1,0%,86
energy-efficient window installation oklahoma city,0,1,0%,87
motorized blinds installer,0,1,0%,89
custom blinds lower village,0,1,0%,93
premium graber blinds,0,1,0%,96
"motorized shades kauai, hi",0,1,0%,98
graber vertical cellular shades,0,1,0%,99
graber window treatments near me,0,1,0%,99
shade structures oklahoma city,0,1,0%,99
smart shades draper,0,1,0%,99
smart home automation nichols hills,0,1,0%,100
graber composite blinds,0,1,0%,105