Top queries,Clicks,Impressions,CTR,Position
yukon ok electric outdoor shades,0,1,0%,9
bethany ok composite shutters,0,1,0%,10
edmond ok custom window shades,0,1,0%,10
edmond ok motorized blackout shades,0,1,0%,10
edmond ok outdoor shades,0,1,0%,10
edmond ok roller shade,0,1,0%,10
edmond ok sheer roller shades,0,1,0%,10
edmond ok sheer shade,0,1,0%,10
edmond ok sheer shades,0,1,0%,10
hunter outlet uk,0,1,0%,10
mustang ok cordless blinds for windows,0,1,0%,10
mustang ok zebra shades,0,1,0%,10
oxford blinds,0,1,0%,10
piedmont ok custom cordless blinds,0,1,0%,10
piedmont ok sheer roller shades,0,1,0%,10
piedmont ok skylight blinds,0,1,0%,10
piedmont ok windows shutters,0,1,0%,10
shades construction,0,1,0%,10
yukon ok automatic blinds,0,1,0%,10
yukon ok blackout cellular shades,0,1,0%,10
bethany ok blackout roller shades,0,1,0%,11
bethany ok blackout shades for windows,0,1,0%,11
bethany ok custom window shades,0,1,0%,11
bethany ok exterior roller shades,0,1,0%,11
bethany ok plantation shutters,0,1,0%,11
bethany ok roman shade,0,1,0%,11
bethany ok sheer draperies,0,1,0%,11
bethany ok wood blinds,0,1,0%,11
bethany ok wooden blinds for windows,0,1,0%,11
edmond ok blinds for windows cordless,0,1,0%,11
edmond ok exterior window shades,0,1,0%,11
edmond ok roman shades blackout,0,1,0%,11
edmond ok wooden shutters,0,1,0%,11
el reno ok motorized blackout shades,0,1,0%,11
mustang ok blackout roman shades,0,1,0%,11
mustang ok outdoor roller shades,0,1,0%,11
mustang ok sheer shades,0,1,0%,11
mustang ok wooden blinds for windows,0,1,0%,11
mustang ok zebra roller shades,0,1,0%,11
nw oklahoma city ok roller shades blackout,0,1,0%,11
piedmont ok cordless window blinds,0,1,0%,11
piedmont ok faux wooden blinds,0,1,0%,11
piedmont ok outdoor motorized shades,0,1,0%,11
piedmont ok plantation shutters,0,1,0%,11
window shades and blinds near me,0,1,0%,11
yukon ok motorized window treatments,0,1,0%,11
yukon ok zebra roller shades,0,1,0%,11
alternatives to blinds,0,1,0%,12
bethany ok cellular shades,0,1,0%,12
bethany ok motorized outdoor shades,0,1,0%,12
bethany ok wood shutters,0,1,0%,12
edmond ok blackout shades,0,1,0%,12
edmond ok exterior shades,0,1,0%,12
edmond ok roller shades for windows,0,1,0%,12
edmond ok track panel blinds,0,1,0%,12
edmond ok vertical cellular shades,0,1,0%,12
edmond ok wood shutters,0,1,0%,12
motorized shade repair near me,0,1,0%,12
mustang ok custom window shade,0,1,0%,12
mustang ok interior plantation shutters,0,1,0%,12
mustang ok outdoor motorized shades,0,1,0%,12
mustang ok roller shade,0,1,0%,12
mustang ok wooden window blinds,0,1,0%,12
nw oklahoma city ok motorized exterior shades,0,1,0%,12
oklahoma city ok automatic blinds,0,1,0%,12
oklahoma city ok blackout cellular shades,0,1,0%,12
oklahoma city ok cellular window shades,0,1,0%,12
oklahoma city ok motorized shades,0,1,0%,12
piedmont ok custom blinds,0,1,0%,12
piedmont ok electric outdoor shades,0,1,0%,12
piedmont ok roller shades for windows,0,1,0%,12
piedmont ok wooden blinds for windows,0,1,0%,12
security shutters nichols hills ok,0,1,0%,12
yukon ok blackout roman shade,0,1,0%,12
yukon ok electric window blinds,0,1,0%,12
yukon ok motorized blackout shades,0,1,0%,12
yukon ok outdoor motorized shades,0,1,0%,12
yukon ok sheer roller shades,0,1,0%,12
yukon ok sheer roman shades,0,1,0%,12
bethany ok bamboo window shades,0,1,0%,13
bethany ok custom window shade,0,1,0%,13
bethany ok roman shades for windows,0,1,0%,13
bethany ok window shutters,0,1,0%,13
blinds and shades stores near me,0,1,0%,13
blinds to go kitchener,0,1,0%,13
edmond ok bamboo shades,0,1,0%,13
edmond ok cordless mini blinds,0,1,0%,13
edmond ok custom mini blinds,0,1,0%,13
edmond ok custom shades for windows,0,1,0%,13
edmond ok draperies,0,1,0%,13
edmond ok faux wooden blinds,0,1,0%,13
edmond ok sheer draperies,0,1,0%,13
edmond ok sheer drapes,0,1,0%,13
edmond ok shutters for windows,0,1,0%,13
edmond ok window blinds,0,1,0%,13
edmond ok windows shutters,0,1,0%,13
motorized blinds near me,0,1,0%,13
mustang ok cordless blinds,0,1,0%,13
mustang ok custom mini blinds,0,1,0%,13
mustang ok wood blinds,0,1,0%,13
nw oklahoma city ok electric blinds,0,1,0%,13
nw oklahoma city ok motorized blinds,0,1,0%,13
nw oklahoma city ok roman shade,0,1,0%,13
oklahoma city ok cellular shades,0,1,0%,13
oklahoma city ok motorized window shades,0,1,0%,13
piedmont ok blinds for windows cordless,0,1,0%,13
piedmont ok faux wood blinds,0,1,0%,13
security shutters piedmont ok,0,1,0%,13
security shutters yukon ok,0,1,0%,13
yukon ok bamboo shade,0,1,0%,13
yukon ok cellular shade,0,1,0%,13
yukon ok cellular shades,0,1,0%,13
yukon ok cordless blinds for windows,0,1,0%,13
yukon ok faux wood blinds,0,1,0%,13
yukon ok sheer window shades,0,1,0%,13
bethany ok blackout window shades,0,1,0%,14
bethany ok faux wood blinds,0,1,0%,14
bethany ok shutters,0,1,0%,14
bethany ok shutters for windows,0,1,0%,14
edmond ok blinds for skylights,0,1,0%,14
edmond ok custom blind,0,1,0%,14
edmond ok custom blinds,0,1,0%,14
edmond ok outdoor shades for patio,0,1,0%,14
el reno ok blackout window shades,0,1,0%,14
el reno ok electric window blinds,0,1,0%,14
el reno ok sheer shade,0,1,0%,14
hard sided hunting blinds,0,1,0%,14
"lutron shades, edmond, ok",0,1,0%,14
mustang ok blackout shades for windows,0,1,0%,14
mustang ok custom window blinds,0,1,0%,14
mustang ok motorized blinds,0,1,0%,14
mustang ok roller shades for windows,0,1,0%,14
nw oklahoma city ok blackout roman shades,0,1,0%,14
nw oklahoma city ok electric outdoor shades,0,1,0%,14
nw oklahoma city ok roller window shades,0,1,0%,14
piedmont ok custom drapery,0,1,0%,14
piedmont ok wood shutters,0,1,0%,14
piedmont ok wooden window blinds,0,1,0%,14
yukon ok outdoor roller shades,0,1,0%,14
yukon ok sheer shade,0,1,0%,14
bethany ok custom cordless blinds,0,1,0%,15
bethany ok custom shades for windows,0,1,0%,15
edmond ok blinds,0,1,0%,15
edmond ok blinds mini blinds,0,1,0%,15
edmond ok custom window blinds,0,1,0%,15
edmond ok house shutters,0,1,0%,15
edmond ok mini blinds,0,1,0%,15
edmond ok sheer roman shades,0,1,0%,15
edmond ok wood blinds,0,1,0%,15
el reno ok cellular shade,0,1,0%,15
el reno ok cellular shades,0,1,0%,15
mustang ok blackout cellular shades,0,1,0%,15
mustang ok blackout shade,0,1,0%,15
mustang ok custom window shades,0,1,0%,15
mustang ok exterior motorized shades,0,1,0%,15
mustang ok sheer drapes,0,1,0%,15
mustang ok shutters for windows,0,1,0%,15
mustang ok window shutters,0,1,0%,15
oklahoma city ok motorized blinds,0,1,0%,15
patio shades yukon ok,0,1,0%,15
piedmont ok motorized outdoor shades,0,1,0%,15
window blinds okc,0,1,0%,15
yukon ok exterior roller shades,0,1,0%,15
yukon ok faux wooden blinds,0,1,0%,15
yukon ok vertical cellular shades,0,1,0%,15
bethany ok blinds mini blinds,0,1,0%,16
bethany ok exterior motorized shades,0,1,0%,16
bethany ok faux wooden blinds,0,1,0%,16
bethany ok sheer drapes,0,1,0%,16
coweta ok electric blinds,0,1,0%,16
coweta ok motorized blackout shades,0,1,0%,16
edmond ok blackout shades for windows,0,1,0%,16
edmond ok custom drapes,0,1,0%,16
edna buxton,0,1,0%,16
"lutron shades, oklahoma city, ok",0,1,0%,16
mustang ok electric blinds,0,1,0%,16
nw oklahoma city ok blackout roman shade,0,1,0%,16
nw oklahoma city ok custom mini blinds,0,1,0%,16
nw oklahoma city ok custom window shade,0,1,0%,16
nw oklahoma city ok sheer roller shades,0,1,0%,16
yukon ok cordless window blinds,0,1,0%,16
yukon ok roller shades for windows,0,1,0%,16
bethany ok panel track blinds,0,1,0%,17
custom roman shades,0,1,0%,17
edmond ok panel track blinds,0,1,0%,17
edmond ok window blind,0,1,0%,17
edmond ok window shutters,0,1,0%,17
edmond ok wooden blinds for windows,0,1,0%,17
mustang ok blackout shades,0,1,0%,17
mustang ok exterior roller shades,0,1,0%,17
mustang ok motorized outdoor shades,0,1,0%,17
nw oklahoma city ok blackout window shades,0,1,0%,17
nw oklahoma city ok roller shades for windows,0,1,0%,17
nw oklahoma city ok sheer window shades,0,1,0%,17
oklahoma city ok motorized blackout shades,0,1,0%,17
outdoor shades oklahoma city,0,1,0%,17
piedmont ok mini blinds,0,1,0%,17
yukon ok blackout shades for windows,0,1,0%,17
bethany ok window blind,0,1,0%,18
bethany ok wooden blinds,0,1,0%,18
collinsville ok electric outdoor shades,0,1,0%,18
coweta ok blackout window shades,0,1,0%,18
coweta ok electric blinds for windows,0,1,0%,18
curtains oklahoma city,0,1,0%,18
custom drapes near me,0,1,0%,18
edmond ok blackout roman shade,0,1,0%,18
edmond ok plantation shutters,0,1,0%,18
edmond ok wooden blinds,0,1,0%,18
edmond ok wooden window blinds,0,1,0%,18
mustang ok blinds for windows,0,1,0%,18
mustang ok outdoor shades for patio,0,1,0%,18
nw oklahoma city ok blinds for windows cordless,0,1,0%,18
nw oklahoma city ok exterior motorized shades,0,1,0%,18
nw oklahoma city ok interior plantation shutters,0,1,0%,18
nw oklahoma city ok motorized outdoor shades,0,1,0%,18
nw oklahoma city ok roman shades for windows,0,1,0%,18
nw oklahoma city ok wood blinds,0,1,0%,18
nw oklahoma city ok wooden blinds,0,1,0%,18
oklahoma city ok faux wooden blinds,0,1,0%,18
piedmont ok exterior roller shades,0,1,0%,18
piedmont ok vertical cellular shades,0,1,0%,18
piedmont ok window blind,0,1,0%,18
sapulpa ok motorized outdoor shades,0,1,0%,18
yukon ok interior plantation shutters,0,1,0%,18
yukon ok motorized outdoor shades,0,1,0%,18
yukon ok sheer shades,0,1,0%,18
yukon ok wooden window blinds,0,1,0%,18
commercial motorized shading oklahoma city,0,1,0%,19
edmond ok blackout window shades,0,1,0%,19
mustang ok blinds mini blinds,0,1,0%,19
mustang ok roman shades,0,1,0%,19
mustang ok roman shades for windows,0,1,0%,19
nw oklahoma city ok custom window shades,0,1,0%,19
nw oklahoma city ok outdoor motorized shades,0,1,0%,19
oklahoma city outdoor shades,0,1,0%,19
patio shades blanchard ok,0,1,0%,19
piedmont ok bamboo shades,0,1,0%,19
piedmont ok motorized exterior shades,0,1,0%,19
piedmont ok window curtains,0,1,0%,19
yukon ok custom mini blinds,0,1,0%,19
yukon ok motorized exterior shades,0,1,0%,19
yukon ok shutters for windows,0,1,0%,19
yukon ok wooden blinds for windows,0,1,0%,19
bethany ok roman shades,0,1,0%,20
bethany ok wooden shutters,0,1,0%,20
edmond ok blackout roller shades,0,1,0%,20
edmond ok roller shades blackout,0,1,0%,20
edmond ok window curtains,0,1,0%,20
nw oklahoma city ok cordless window blinds,0,1,0%,20
nw oklahoma city ok custom shades for windows,0,1,0%,20
nw oklahoma city ok sheer fabric shades,0,1,0%,20
oklahoma city ok electric outdoor shades,0,1,0%,20
oklahoma city outdoor blinds,0,1,0%,20
sapulpa ok electric outdoor shades,0,1,0%,20
venetian blind alternatives,0,1,0%,20
yukon ok blinds for skylights,0,1,0%,20
bethany ok outdoor motorized shades,0,1,0%,21
graber blinds dealers near me,0,1,0%,21
oklahoma city ok faux wood blinds,0,1,0%,21
yukon ok motorized retractable screens for patio,0,1,0%,21
nw oklahoma city ok wooden shutters,0,1,0%,22
oklahoma city ok blackout roller shades,0,1,0%,22
yukon ok custom window shades,0,1,0%,22
oklahoma city ok blackout roman shades,0,1,0%,24
oklahoma city ok wood blinds,0,1,0%,26
oklahoma city ok blackout roman shade,0,1,0%,27
oklahoma city ok composite window shutters,0,1,0%,27
jenks ok blackout roman shade,0,1,0%,28
norman window,0,1,0%,29
oklahoma city ok blackout shades,0,1,0%,30
oklahoma city ok custom mini blinds,0,1,0%,30
oklahoma city ok custom shades for windows,0,1,0%,30
norman window coverings,0,1,0%,32
norman roman shades,0,1,0%,33
graber blinds and shades,0,1,0%,35
are hunter douglas blinds worth it,0,1,0%,40
dealer.graberblinds.com,0,1,0%,40
graber blinds near me,0,1,0%,41
sunrooms oklahoma city,0,1,0%,43
composite windows edmond,0,1,0%,45
window shades in raymond,0,1,0%,48
sunrooms yukon,0,1,0%,49
smart shades near me,0,1,0%,53
motorized shades sandestin,0,1,0%,57
norman brand blinds,0,1,0%,60
graber blinds phone number,0,1,0%,62
norman's blinds,0,1,0%,65
smart home automation nichols hills,0,1,0%,66
mini blind alternatives,0,1,0%,68
who sells graber blinds,0,1,0%,68
window blinds alternatives,0,1,0%,72
in the shade,0,1,0%,75
"motorized shades granger, in",0,1,0%,77
graber windows,0,1,0%,78
norman window fashions dealer plum pa,0,1,0%,79
motorized shades installers,0,1,0%,82
decorative shutters sun city,0,1,0%,84
graber blinds prices,0,1,0%,84
motorized shading installer,0,1,0%,87
norman blackout shades,0,1,0%,89
graberblinds,0,1,0%,90
oakmont motorized shades,0,1,0%,92
solar shades nighttime privacy,0,1,0%,94
electric shades odem,0,1,0%,96
graber wood shutters,0,1,0%,97
oakmont blinds and shades,0,1,0%,99
energy efficient windows okc,0,1,0%,100
interior window shutters grayson,0,1,0%,100
smart drapes by norman,0,1,0%,100
graber fabrics,0,1,0%,102
shades and blinds oakmont,0,1,0%,105