Top queries,Clicks,Impressions,CTR,Position
hunter douglas,2,128,1.56%,2.7
is hunter douglas expensive,1,9,11.11%,2.89
hunter douglas duette honeycomb shades,1,5,20%,2.4
hunter douglas mumbai,1,2,50%,2
what are the 3 levels of light blocking translucent,0,172,0%,21.08
blinds oklahoma city,0,58,0%,15.48
"""18004blinds""",0,42,0%,2.71
graber custom window coverings,0,26,0%,43.54
graber vs hunter douglas,0,25,0%,15.2
graber shutters plantation,0,23,0%,49.13
graber mezzanine layered zebra sheer shades,0,23,0%,62.04
graber window treatments cost,0,21,0%,67.14
hunter douglas blinds cost,0,20,0%,41.35
graber banded shades,0,20,0%,56
graber interior shutters,0,20,0%,64.3
graber motorized shades cost,0,19,0%,73.63
graber zebra blinds,0,18,0%,71.11
hunter douglas official site,0,17,0%,4.53
graber window shutters,0,17,0%,73.12
are hunter douglas blinds expensive,0,16,0%,8.31
blinds okc,0,16,0%,19.19
motorized blinds installer,0,16,0%,83.25
window shutters sun city,0,15,0%,71.13
hunter douglas pricing,0,14,0%,24.57
graber window products,0,14,0%,61.57
graber plantation shutters prices,0,14,0%,73.86
graber roller shades pricing,0,14,0%,91.21
norman shades,0,13,0%,32.69
graber shutter,0,13,0%,77.08
hunter boots,0,12,0%,4.5
motorized retractable shades oklahoma city,0,12,0%,6.58
blind alternatives,0,12,0%,51.17
graber custom window treatments,0,12,0%,55.83
"""window blinds oklahoma city""",0,10,0%,6.5
window treatments oklahoma city,0,10,0%,11.6
window treatments okc,0,10,0%,17.6
what is hunter douglas,0,8,0%,1
hunter douglas shades,0,8,0%,2
custom blinds oklahoma city,0,8,0%,12.38
window shades okc,0,8,0%,14.88
oklahoma city blinds,0,8,0%,17.12
blinds in okc,0,8,0%,19.5
hunter douglas vertical blinds cost,0,8,0%,78.12
hunter douglas canada,0,7,0%,2.43
hunter douglas blinds,0,7,0%,2.86
hunter douglas roller shades,0,7,0%,3.29
custom window treatments oklahoma city,0,7,0%,10.86
outdoor roller shades oklahoma city,0,7,0%,12.57
custom blinds for windows oklahoma city,0,7,0%,13
hunter douglas vs graber,0,7,0%,13.57
oakmont custom interior shutters,0,7,0%,64
alternative to blinds,0,7,0%,75.14
graber shutter blinds,0,7,0%,84
graber shades blinds,0,7,0%,95.29
luxury roller shades,0,6,0%,1
hunter douglas malaysia,0,6,0%,2.33
hunter blinds,0,6,0%,3
"""custom blinds oklahoma city""",0,6,0%,3.5
hunter wellies,0,6,0%,6.33
hunter backpack,0,6,0%,8
graber vs norman shutters,0,6,0%,10.17
patio shades nichols hills ok,0,6,0%,11.17
blinds edmond ok,0,6,0%,13.17
graber blinds vs hunter douglas,0,6,0%,18.67
norman window shades,0,6,0%,26.17
premium shades,0,6,0%,37.17
graber window treatments dealership,0,6,0%,57.33
sheer window shades oakmont,0,6,0%,91
hunter douglas australia,0,5,0%,2.8
hunter douglas vignette roman shades price,0,5,0%,4
hunter rain boots,0,5,0%,6.8
warr acres ok custom blinds,0,5,0%,15
security shutters edmond ok,0,5,0%,16
sunrooms norman,0,5,0%,16.2
okc blinds,0,5,0%,17.2
hunter douglas cost,0,5,0%,27.4
blinds oklahoma city ok,0,5,0%,55.2
smartdrape shades nearby,0,5,0%,67.2
blinds installer,0,5,0%,69.6
designer window coverings,0,4,0%,1
are hunter douglas shades expensive,0,4,0%,4
hunter douglas vertiglide,0,4,0%,4.75
oklahoma city motorized blinds,0,4,0%,5.5
oklahoma city motorized shades,0,4,0%,6.5
warr acres ok automatic blinds,0,4,0%,7.75
window treatment oklahoma city,0,4,0%,7.75
piedmont ok bamboo shade,0,4,0%,10
sliding-door-window-coverings in oklahoma city,0,4,0%,10
piedmont ok electric blinds for windows,0,4,0%,10.25
warr acres ok roller shades for windows,0,4,0%,10.25
bethany ok sheer roller shades,0,4,0%,11.25
piedmont ok sheer draperies,0,4,0%,12.5
patio shades edmond ok,0,4,0%,12.75
bethany ok roller shades for windows,0,4,0%,13
motorized patio shades oklahoma city,0,4,0%,13
nw oklahoma city ok cellular shade,0,4,0%,13.25
bethany ok roller window shades,0,4,0%,13.5
motorized porch shades oklahoma city,0,4,0%,13.5
oklahoma city office blinds,0,4,0%,14.5
piedmont ok sheer fabric shades,0,4,0%,14.5
nw oklahoma city ok electric blinds for windows,0,4,0%,15.75
sunrooms edmond,0,4,0%,18
motorized shades near me,0,4,0%,26.75
energy efficient windows norman,0,4,0%,32
window company edmond,0,4,0%,44
hunter douglas shutters cost,0,3,0%,1
hunter douglas vertiglide price,0,3,0%,1
hunter douglas sri city,0,3,0%,2
hunter douglas products,0,3,0%,2.33
hunter douglas official website,0,3,0%,2.67
does hunter douglas have sales,0,3,0%,3
hunter douglas orange book,0,3,0%,3
the shade store,0,3,0%,3
hunter douglas gallery,0,3,0%,3.33
hunter douglas window coverings,0,3,0%,3.33
hunter douglas window treatments,0,3,0%,3.33
hunter douglas per,0,3,0%,5
warr acres ok motorized outdoor shades,0,3,0%,5.67
norman shutters vs graber shutters,0,3,0%,6.33
hunter shoes,0,3,0%,6.67
oklahoma city cellular shades,0,3,0%,7
custom shades edmond,0,3,0%,7.67
warr acres ok custom shades for windows,0,3,0%,8
bethany ok sheer shade,0,3,0%,9
edmond ok electric window blinds,0,3,0%,9
oklahoma city window treatments,0,3,0%,9.67
edmond custom blinds and shades,0,3,0%,10.33
edmond window treatments,0,3,0%,10.33
"motorized window shades, edmond, ok",0,3,0%,10.33
edmond window coverings,0,3,0%,11
piedmont ok cellular shade,0,3,0%,11
window covering edmond,0,3,0%,11
edmond custom window coverings,0,3,0%,11.33
edmond custom window treatments,0,3,0%,11.33
patio shades piedmont ok,0,3,0%,11.67
mustang ok roller window shades,0,3,0%,12
nw oklahoma city ok electric window blinds,0,3,0%,12
blinds edmond,0,3,0%,12.33
custom blinds edmond,0,3,0%,13.33
oklahoma city custom blinds and shades,0,3,0%,13.33
bethany ok motorized blinds,0,3,0%,13.67
oklahoma city window coverings,0,3,0%,13.67
warr acres ok blackout shades,0,3,0%,14
warr acres ok blinds mini blinds,0,3,0%,14
oklahoma city roman shades,0,3,0%,14.33
custom blinds installation edmond,0,3,0%,15
oklahoma city wood blinds,0,3,0%,15
oklahoma city faux wood blinds,0,3,0%,15.33
oklahoma city custom blinds,0,3,0%,15.67
nw oklahoma city ok motorized window treatment,0,3,0%,16
warr acres ok custom window shade,0,3,0%,16.33
edmond ok cellular shade,0,3,0%,16.67
oklahoma city custom window treatments,0,3,0%,16.67
warr acres ok blinds for windows,0,3,0%,16.67
warr acres ok mini blinds,0,3,0%,17.33
oklahoma city custom window coverings,0,3,0%,17.67
patio shades oklahoma city,0,3,0%,17.67
"motorized blinds oklahoma city, ok",0,3,0%,20.33
graber dealers near me,0,3,0%,26.33
graber blinds customer service,0,3,0%,28.33
norman shades and blinds,0,3,0%,30.67
graber window blinds dealership,0,3,0%,45
graber simple selections,0,3,0%,55
motorized shades everman,0,3,0%,70
hunter douglas blinds quality,0,3,0%,77
cellular shades oakmont,0,3,0%,88
blinds and shades oakmont,0,3,0%,89.33
graber window fashions,0,3,0%,91.33
efficient sunroom heating and cooling solutions | mid-state,0,3,0%,96.67
window coverings graber,0,3,0%,99
high end window shades,0,2,0%,1
is hunter douglas blinds expensive,0,2,0%,1
vienna window shades,0,2,0%,1
can you buy hunter douglas blinds online,0,2,0%,2
hunter douglas designer roller shades,0,2,0%,2
hunter douglas retail,0,2,0%,2
hunter douglas website,0,2,0%,2
hunter holsters reviews,0,2,0%,2
hunterdouglas,0,2,0%,2
shade store,0,2,0%,2
hunter brand,0,2,0%,2.5
hunter douglas bangalore,0,2,0%,2.5
hunter douglas roller blinds,0,2,0%,2.5
hunter douglas singapore,0,2,0%,2.5
hunter douglass,0,2,0%,2.5
edmond ok motorized window treatments,0,2,0%,3
how much are hunter douglas blinds,0,2,0%,3
hunter douglas omaha,0,2,0%,3
hunter douglas roman shades,0,2,0%,3
hunter douglas middle east fze,0,2,0%,3.5
costco hunter douglas blinds,0,2,0%,4
douglas blinds,0,2,0%,4
hunter douglas latest,0,2,0%,4
costco window treatments,0,2,0%,4.5
hunter clothing,0,2,0%,5
warr acres ok roller shades blackout,0,2,0%,5
hunter boots women,0,2,0%,5.5
warr acres ok cellular shade,0,2,0%,6.5
piedmont ok zebra roller shades,0,2,0%,7
warr acres ok electric outdoor shades,0,2,0%,7
bethany ok zebra shades,0,2,0%,7.5
shade doctor near me,0,2,0%,7.5
warr acres ok motorized blinds,0,2,0%,7.5
warr acres ok motorized window treatments,0,2,0%,7.5
warr acres ok outdoor motorized shades,0,2,0%,7.5
warr acres ok roller shade,0,2,0%,7.5
warr acres ok roller shades,0,2,0%,7.5
warr acres ok roman shade,0,2,0%,7.5
warr acres ok sheer fabric shades,0,2,0%,7.5
edmond ok cordless window blinds,0,2,0%,8
mustang ok electric window blinds,0,2,0%,8
warr acres ok blackout roman shades,0,2,0%,8
warr acres ok blackout shades for windows,0,2,0%,8
warr acres ok composite shutters,0,2,0%,8
warr acres ok motorized window shades,0,2,0%,8
warr acres ok skylight blinds,0,2,0%,8
warr acres ok window shutters,0,2,0%,8
warr acres ok zebra shades,0,2,0%,8
bethany ok cordless blinds,0,2,0%,8.5
warr acres ok roman shades,0,2,0%,8.5
warr acres ok roman shades for windows,0,2,0%,8.5
bethany ok sheer roman shades,0,2,0%,9
bethany ok sheer shades,0,2,0%,9
piedmont ok motorized blackout shades,0,2,0%,9
warr acres ok blackout window shades,0,2,0%,9
warr acres ok custom draperies,0,2,0%,9
warr acres ok custom mini blinds,0,2,0%,9
warr acres ok outdoor roller shades,0,2,0%,9
warr acres ok sheer roller shades,0,2,0%,9
warr acres ok sheer shades,0,2,0%,9
bethany ok automatic blinds,0,2,0%,9.5
bethany ok blackout shade,0,2,0%,9.5
edmond ok motorized shades,0,2,0%,9.5
edmond ok motorized window treatment,0,2,0%,9.5
edmond ok zebra shades,0,2,0%,9.5
piedmont ok motorized shades,0,2,0%,9.5
piedmont ok sheer shades,0,2,0%,9.5
warr acres ok bamboo shade,0,2,0%,9.5
warr acres ok custom blind,0,2,0%,9.5
warr acres ok custom window shades,0,2,0%,9.5
warr acres ok motorized window treatment,0,2,0%,9.5
warr acres ok shutters for windows,0,2,0%,9.5
warr acres ok vertical cellular shades,0,2,0%,9.5
warr acres ok windows shutters,0,2,0%,9.5
bethany ok motorized window treatments,0,2,0%,10
edmond ok electric blinds,0,2,0%,10
mustang ok composite shutters,0,2,0%,10
oklahoma city ok motorized window treatment,0,2,0%,10
piedmont ok motorized blinds,0,2,0%,10
piedmont ok roman shades,0,2,0%,10
warr acres ok motorized exterior shades,0,2,0%,10
warr acres ok roller window shades,0,2,0%,10
bethany ok electric blinds for windows,0,2,0%,10.5
edmond ok electric blinds for windows,0,2,0%,10.5
edmond ok zebra shade blinds,0,2,0%,10.5
piedmont ok blackout cellular shades,0,2,0%,10.5
piedmont ok motorized window treatments,0,2,0%,10.5
piedmont ok roller shade,0,2,0%,10.5
warr acres ok blinds for skylights,0,2,0%,10.5
warr acres ok draperies,0,2,0%,10.5
warr acres ok exterior roller shades,0,2,0%,10.5
warr acres ok motorized shades,0,2,0%,10.5
warr acres ok sheer shade,0,2,0%,10.5
warr acres ok wood blinds,0,2,0%,10.5
bethany ok electric window blinds,0,2,0%,11
bethany ok sheer fabric shades,0,2,0%,11
edmond ok motorized window shades,0,2,0%,11
mustang ok custom shades for windows,0,2,0%,11
mustang ok sheer roller shades,0,2,0%,11
oklahoma city roller shades,0,2,0%,11
piedmont ok sheer shade,0,2,0%,11
piedmont ok zebra shades,0,2,0%,11
warr acres ok bamboo shades,0,2,0%,11
warr acres ok custom cordless blinds,0,2,0%,11
warr acres ok plantation shutters,0,2,0%,11
warr acres ok sheer roman shades,0,2,0%,11
window treatment near me,0,2,0%,11
mustang ok sheer shade,0,2,0%,11.5
piedmont ok automatic blinds,0,2,0%,11.5
piedmont ok electric window blinds,0,2,0%,11.5
piedmont ok sheer roman shades,0,2,0%,11.5
warr acres ok blackout shade,0,2,0%,11.5
warr acres ok sheer window shades,0,2,0%,11.5
warr acres ok wood shutters,0,2,0%,11.5
warr acres ok wooden shutters,0,2,0%,11.5
window covering oklahoma city,0,2,0%,11.5
yukon ok zebra shade blinds,0,2,0%,11.5
bethany ok blackout shades,0,2,0%,12
bethany ok motorized window treatment,0,2,0%,12
edmond ok blackout shade,0,2,0%,12
piedmont ok blinds mini blinds,0,2,0%,12
warr acres ok custom curtains,0,2,0%,12
warr acres ok custom drapes,0,2,0%,12
warr acres ok custom window blinds,0,2,0%,12
warr acres ok faux wooden blinds,0,2,0%,12
warr acres ok wooden blinds,0,2,0%,12
bethany ok cellular window shades,0,2,0%,12.5
bethany ok exterior window shades,0,2,0%,12.5
bethany ok motorized blackout shades,0,2,0%,12.5
edmond ok bamboo window shades,0,2,0%,12.5
edmond ok motorized blinds,0,2,0%,12.5
edmond ok sheer fabric shades,0,2,0%,12.5
mustang ok motorized blackout shades,0,2,0%,12.5
mustang ok motorized window shades,0,2,0%,12.5
mustang ok sheer roman shades,0,2,0%,12.5
piedmont ok blackout shades,0,2,0%,12.5
piedmont ok shutters for windows,0,2,0%,12.5
warr acres ok wooden window blinds,0,2,0%,12.5
yukon ok motorized blinds,0,2,0%,12.5
yukon ok zebra shades,0,2,0%,12.5
bethany ok cellular shade,0,2,0%,13
bethany ok motorized window shades,0,2,0%,13
bethany ok sheer window shades,0,2,0%,13
edmond ok cellular shades,0,2,0%,13
mustang ok cellular window shades,0,2,0%,13
mustang ok wooden shutters,0,2,0%,13
piedmont ok blackout roman shade,0,2,0%,13
piedmont ok blackout shade,0,2,0%,13
piedmont ok drapery,0,2,0%,13
piedmont ok motorized window treatment,0,2,0%,13
warr acres ok window blind,0,2,0%,13
warr acres ok window curtains,0,2,0%,13
bethany ok blackout roman shades,0,2,0%,13.5
bethany ok roller shades,0,2,0%,13.5
bethany ok wooden window blinds,0,2,0%,13.5
edmond ok automatic blinds,0,2,0%,13.5
edmond ok blackout cellular shades,0,2,0%,13.5
piedmont ok blinds for skylights,0,2,0%,13.5
piedmont ok roman shades for windows,0,2,0%,13.5
warr acres ok bamboo window shades,0,2,0%,13.5
warr acres ok exterior window shades,0,2,0%,13.5
warr acres ok wooden blinds for windows,0,2,0%,13.5
yukon ok sheer fabric shades,0,2,0%,13.5
bethany ok blackout cellular shades,0,2,0%,14
edmond ok cordless blinds,0,2,0%,14
edmond ok custom cordless blinds,0,2,0%,14
edmond ok motorized exterior shades,0,2,0%,14
mustang ok automatic blinds,0,2,0%,14
mustang ok sheer fabric shades,0,2,0%,14
patio shades mustang ok,0,2,0%,14
piedmont ok blackout roman shades,0,2,0%,14
piedmont ok roman shade,0,2,0%,14
piedmont ok sheer window shades,0,2,0%,14
warr acres ok outdoor shades for patio,0,2,0%,14
edmond ok bamboo shade,0,2,0%,14.5
mustang ok cellular shades,0,2,0%,14.5
piedmont ok custom mini blinds,0,2,0%,14.5
yukon ok cellular window shades,0,2,0%,14.5
yukon ok electric blinds for windows,0,2,0%,14.5
edmond ok custom draperies,0,2,0%,15
edmond ok exterior roller shades,0,2,0%,15
yukon ok composite shutters,0,2,0%,15
coweta ok roller shades blackout,0,2,0%,15.5
mustang ok sheer window shades,0,2,0%,15.5
piedmont ok blackout shades for windows,0,2,0%,15.5
sunrooms nicholson,0,2,0%,15.5
yukon ok blackout roman shades,0,2,0%,15.5
bethany ok custom window blinds,0,2,0%,16
mustang ok exterior shades,0,2,0%,16
edmond ok motorized outdoor shades,0,2,0%,16.5
edmond ok sheer window shades,0,2,0%,16.5
bethany ok roman shades blackout,0,2,0%,17
mustang ok electric blinds for windows,0,2,0%,17
mustang ok wooden blinds,0,2,0%,17
nw oklahoma city ok motorized window shades,0,2,0%,17
oklahoma city commercial blinds,0,2,0%,17.5
shaded in,0,2,0%,18
blinds near me,0,2,0%,18.5
edmond ok cellular window shades,0,2,0%,18.5
graber customer service,0,2,0%,18.5
patio shades norman ok,0,2,0%,18.5
coweta ok cordless window blinds,0,2,0%,19
edmond ok cordless blinds for windows,0,2,0%,19
piedmont ok house shutters,0,2,0%,19
custom drapes oklahoma city,0,2,0%,19.5
oklahoma city plantation shutters,0,2,0%,19.5
edmond ok custom drapery,0,2,0%,20
edmond ok blackout roman shades,0,2,0%,20.5
edmond ok roman shades for windows,0,2,0%,21
edmond ok interior plantation shutters,0,2,0%,22.5
graber dealer,0,2,0%,22.5
oklahoma city ok sheer fabric shades,0,2,0%,22.5
"automated blinds oklahoma city, ok",0,2,0%,28
norman shutters blinds shades,0,2,0%,28.5
how much do hunter douglas blinds cost,0,2,0%,31.5
energy efficient windows edmond,0,2,0%,46.5
motorized interior shutters oakmont,0,2,0%,49
graber window blinds,0,2,0%,51.5
graber window treatments,0,2,0%,51.5
window shades installation excelsior,0,2,0%,56
graber window covering,0,2,0%,59
budget blinds of edmond,0,2,0%,59.5
residential window blinds,0,2,0%,62.5
alternatives to window blinds,0,2,0%,63.5
motorized blinds installers,0,2,0%,70
graber blinds,0,2,0%,73
electric shades everman,0,2,0%,74
graber shutter style blinds,0,2,0%,75.5
wooden shutters sun city,0,2,0%,77
alternative for blinds,0,2,0%,79
motorized blinds installation service,0,2,0%,79.5
interior window shutters sun city,0,2,0%,86
motorized shades oakmont,0,2,0%,87
automated blinds installers,0,2,0%,87.5
graber promotions,0,2,0%,91
shades instead of blinds,0,2,0%,94.5
best blinds brand,0,1,0%,1
blind curtain,0,1,0%,1
blind manufacturers,0,1,0%,1
designer blinds and shades,0,1,0%,1
expensive window blinds,0,1,0%,1
good quality window blinds,0,1,0%,1
high end roller shades,0,1,0%,1
hunter douglas blackout shades price,0,1,0%,1
hunter douglas blind company,0,1,0%,1
hunter douglas faux wood blinds cost,0,1,0%,1
hunter douglas pirouette cost,0,1,0%,1
hunter douglas vs graber blinds,0,1,0%,1
pirouette blinds cost,0,1,0%,1
pirouette shades cost,0,1,0%,1
powerview hunter douglas cost,0,1,0%,1
shade specialist,0,1,0%,1
sun and shade,0,1,0%,1
warr acres ok motorized blackout shades,0,1,0%,1
who is hunter douglas,0,1,0%,1
why is the shade store so expensive,0,1,0%,1
window shades near me,0,1,0%,1
automated shade store,0,1,0%,2
best blinds brands,0,1,0%,2
best quality window shades,0,1,0%,2
blind companies,0,1,0%,2
blinds bel air md,0,1,0%,2
dynamo decor calgary hunter douglas in-home consultation,0,1,0%,2
hundred douglas,0,1,0%,2
hunter blinds near me,0,1,0%,2
hunter boots black friday sale,0,1,0%,2
hunter boots chicago,0,1,0%,2
hunter brand wellies,0,1,0%,2
hunter davis blinds,0,1,0%,2
hunter doughlas,0,1,0%,2
hunter douglas applause,0,1,0%,2
hunter douglas awnings,0,1,0%,2
hunter douglas brite,0,1,0%,2
hunter douglas colorado,0,1,0%,2
hunter douglas costco canada,0,1,0%,2
hunter douglas cumberland md,0,1,0%,2
hunter douglas europe,0,1,0%,2
hunter douglas nantucket shades,0,1,0%,2
hunter douglas new york,0,1,0%,2
hunter douglas nyc office,0,1,0%,2
hunter douglas sale costco,0,1,0%,2
hunter douglas shah alam,0,1,0%,2
hunter douglas shannon ms,0,1,0%,2
hunter douglas shutters,0,1,0%,2
hunter douglas uk retail limited,0,1,0%,2
hunter douglas usa,0,1,0%,2
hunter douglas vs shade store,0,1,0%,2
hunter douglas warehouse,0,1,0%,2
hunter douglas wikipedia,0,1,0%,2
hunter jacket brand,0,1,0%,2
hunter ks,0,1,0%,2
hunter regent street,0,1,0%,2
la custom blinds reviews,0,1,0%,2
larry's design center,0,1,0%,2
silhouette hunter douglas,0,1,0%,2
sun shades window fashions,0,1,0%,2
warr acres ok electric blinds,0,1,0%,2
warr acres ok exterior motorized shades,0,1,0%,2
a1_blends,0,1,0%,3
ahd blind factory,0,1,0%,3
alustra hunter douglas,0,1,0%,3
blackout hunter douglas,0,1,0%,3
blind showcase,0,1,0%,3
blinds store near me,0,1,0%,3
blinds to go,0,1,0%,3
blinds.com roller shades,0,1,0%,3
canadian blind company,0,1,0%,3
chinese blinds,0,1,0%,3
costco blinds review,0,1,0%,3
costco window treatment,0,1,0%,3
french wellies brand,0,1,0%,3
haines hunter boats,0,1,0%,3
harmony blinds,0,1,0%,3
hunter,0,1,0%,3
hunter bell,0,1,0%,3
hunter boot bag,0,1,0%,3
hunter boots bicester village,0,1,0%,3
hunter boots outlet store locations,0,1,0%,3
hunter boots tj maxx,0,1,0%,3
hunter brand wiki,0,1,0%,3
hunter clothes brand,0,1,0%,3
hunter douglas atlanta ga,0,1,0%,3
hunter douglas banded shades,0,1,0%,3
hunter douglas contract,0,1,0%,3
hunter douglas drapes,0,1,0%,3
hunter douglas duolite,0,1,0%,3
hunter douglas motorized blinds price,0,1,0%,3
hunter douglas naples,0,1,0%,3
hunter douglas nottingham,0,1,0%,3
hunter douglas philippines,0,1,0%,3
hunter douglas sale,0,1,0%,3
hunter douglas shade repair,0,1,0%,3
hunter douglas uk,0,1,0%,3
hunter douglas vignette roman shades,0,1,0%,3
hunter pro-c irrigation controller,0,1,0%,3
hunter rubber boots,0,1,0%,3
hunter saftey boots,0,1,0%,3
hunter shades,0,1,0%,3
hunter shoes nyc,0,1,0%,3
hunter shoes women,0,1,0%,3
hunter stoves,0,1,0%,3
hunter tool systems,0,1,0%,3
hunter wheel alignment near me,0,1,0%,3
hunters shoes,0,1,0%,3
is hunter a good brand,0,1,0%,3
luminette hunter douglas,0,1,0%,3
maxxmar blinds,0,1,0%,3
select blinds,0,1,0%,3
shutters,0,1,0%,3
the blind broker,0,1,0%,3
warr acres ok cellular shades,0,1,0%,3
warr acres ok cellular window shades,0,1,0%,3
warr acres ok cordless blinds,0,1,0%,3
warr acres ok zebra roller shades,0,1,0%,3
warr acres ok zebra shade blinds,0,1,0%,3
window blinds near me,0,1,0%,3
best cellular shades,0,1,0%,4
best shade company,0,1,0%,4
blinds wildwood mo,0,1,0%,4
custom motorized shades,0,1,0%,4
hunter bag,0,1,0%,4
hunter chelsea boots,0,1,0%,4
hunter douglas atlanta,0,1,0%,4
hunter douglas logo,0,1,0%,4
hunter douglas pirouette,0,1,0%,4
hunter douglas sheer panels,0,1,0%,4
hunter douglas skyline,0,1,0%,4
hunter douglas utah,0,1,0%,4
hunter engineering,0,1,0%,4
hunter holsters,0,1,0%,4
hunter outlet store,0,1,0%,4
hunter rubber boots womens,0,1,0%,4
hunter wheel alignment,0,1,0%,4
huntington douglas,0,1,0%,4
made in the shade,0,1,0%,4
outta site hunting blinds,0,1,0%,4
redneck blinds,0,1,0%,4
skyline hunter douglas,0,1,0%,4
warr acres ok blinds,0,1,0%,4
warr acres ok cordless blinds for windows,0,1,0%,4
warr acres ok drapery,0,1,0%,4
warr acres ok electric blinds for windows,0,1,0%,4
warr acres ok electric window blinds,0,1,0%,4
warr acres ok roman shades blackout,0,1,0%,4
warr acres ok window blinds,0,1,0%,4
why are hunter boots so expensive,0,1,0%,4
women's hunter rain boots,0,1,0%,4
womens hunter boots,0,1,0%,4
automatic blackout blinds,0,1,0%,5
bali solar shades,0,1,0%,5
blinds palm coast,0,1,0%,5
edmond ok zebra roller shades,0,1,0%,5
green hunter boots,0,1,0%,5
hunter boots men,0,1,0%,5
hunter brand clothing website,0,1,0%,5
hunter brown stats,0,1,0%,5
hunter douglas broomfield co,0,1,0%,5
hunter douglas calgary,0,1,0%,5
hunter douglas charlottesville va,0,1,0%,5
hunter douglas illuminated shades,0,1,0%,5
hunter douglas woven wood shades,0,1,0%,5
hunter hawkeye,0,1,0%,5
hunter red,0,1,0%,5
hunter shoes men,0,1,0%,5
hunter t shirts,0,1,0%,5
literise,0,1,0%,5
midwest blind and shade,0,1,0%,5
mustang ok motorized window treatment,0,1,0%,5
piedmont ok electric blinds,0,1,0%,5
piedmont ok zebra shade blinds,0,1,0%,5
shades under the sun,0,1,0%,5
somfy curtain motor price india,0,1,0%,5
warr acres ok blackout cellular shades,0,1,0%,5
warr acres ok blackout roman shade,0,1,0%,5
warr acres ok cordless window blinds,0,1,0%,5
warr acres ok custom drapery,0,1,0%,5
warr acres ok exterior shades,0,1,0%,5
warr acres ok faux wood blinds,0,1,0%,5
warr acres ok outdoor shades,0,1,0%,5
yukon ok motorized window treatment,0,1,0%,5
"""motorized blinds oklahoma city""",0,1,0%,6
bethany ok cordless window blinds,0,1,0%,6
bethany ok electric blinds,0,1,0%,6
bethany ok vertical cellular shades,0,1,0%,6
bethany ok zebra roller shades,0,1,0%,6
bethany ok zebra shade blinds,0,1,0%,6
hunter back pack,0,1,0%,6
hunter boors,0,1,0%,6
hunter douglas roller shade,0,1,0%,6
hunter green wellies,0,1,0%,6
hunter jumper clothes,0,1,0%,6
hunyer douglas,0,1,0%,6
mustang ok motorized window treatments,0,1,0%,6
nw oklahoma city ok motorized window treatments,0,1,0%,6
piedmont ok cellular window shades,0,1,0%,6
piedmont ok panel track blinds,0,1,0%,6
warr acres ok blackout roller shades,0,1,0%,6
warr acres ok house shutters,0,1,0%,6
warr acres ok panel track blinds,0,1,0%,6
warr acres ok sheer draperies,0,1,0%,6
window shades beaufort sc,0,1,0%,6
bethany ok blackout roman shade,0,1,0%,7
curtain shop near me,0,1,0%,7
edmond ok custom window shade,0,1,0%,7
edmond ok exterior motorized shades,0,1,0%,7
hunter douglas cord loop,0,1,0%,7
hunter douglas south africa,0,1,0%,7
hunter socks,0,1,0%,7
leopard hunter boots,0,1,0%,7
piedmont ok cellular shades,0,1,0%,7
piedmont ok custom shades for windows,0,1,0%,7
piedmont ok custom window shade,0,1,0%,7
piedmont ok draperies,0,1,0%,7
piedmont ok motorized window shades,0,1,0%,7
piedmont ok outdoor shades for patio,0,1,0%,7
trapezoid shades,0,1,0%,7
warr acres ok blinds for windows cordless,0,1,0%,7
warr acres ok drapes,0,1,0%,7
warr acres ok shutters,0,1,0%,7
yukon ok motorized window shades,0,1,0%,7
bethany ok electric outdoor shades,0,1,0%,8
bethany ok motorized shades,0,1,0%,8
blindify,0,1,0%,8
cheap hunter wellies,0,1,0%,8
edmond ok composite shutters,0,1,0%,8
edmond ok electric outdoor shades,0,1,0%,8
edmond ok outdoor motorized shades,0,1,0%,8
edmond ok roller shades,0,1,0%,8
edmond ok skylight blinds,0,1,0%,8
hunter brand backpack,0,1,0%,8
hunter toddler raincoat,0,1,0%,8
kenzo hunter,0,1,0%,8
mens hinter wellies,0,1,0%,8
mustang ok bamboo window shades,0,1,0%,8
mustang ok zebra shade blinds,0,1,0%,8
nw oklahoma city ok motorized shades,0,1,0%,8
oklahoma city ok motorized window treatments,0,1,0%,8
piedmont ok blackout roller shades,0,1,0%,8
piedmont ok custom window blinds,0,1,0%,8
piedmont ok exterior motorized shades,0,1,0%,8
piedmont ok outdoor roller shades,0,1,0%,8
piedmont ok roller shades blackout,0,1,0%,8
piedmont ok sheer drapes,0,1,0%,8
solar blinds,0,1,0%,8
thehunter,0,1,0%,8
warr acres ok custom curtain,0,1,0%,8
warr acres ok interior plantation shutters,0,1,0%,8
bethany ok bamboo shade,0,1,0%,9
bethany ok roller shade,0,1,0%,9
bethany ok roller shades blackout,0,1,0%,9
boolegon,0,1,0%,9
custom window blinds,0,1,0%,9
edmond ok outdoor roller shades,0,1,0%,9
edmond ok roller window shades,0,1,0%,9
houston blind company,0,1,0%,9
hunters wellies,0,1,0%,9
mens hunter boots sale,0,1,0%,9
motorized shades oklahoma city,0,1,0%,9
muddy deer blinds,0,1,0%,9
mustang ok cellular shade,0,1,0%,9
nw oklahoma city ok blackout cellular shades,0,1,0%,9
nw oklahoma city ok motorized blackout shades,0,1,0%,9
piedmont ok blackout window shades,0,1,0%,9
piedmont ok composite shutters,0,1,0%,9
piedmont ok custom window shades,0,1,0%,9
piedmont ok outdoor shades,0,1,0%,9
piedmont ok roller shades,0,1,0%,9
piedmont ok roller window shades,0,1,0%,9
piedmont ok roman shades blackout,0,1,0%,9
tdbu shades,0,1,0%,9
warr acres ok curtains,0,1,0%,9
women's wellies hunter,0,1,0%,9
