Top queries,Clicks,Impressions,CTR,Position
blinds oklahoma city,0,63,0%,15.87
window shades okc,0,27,0%,20.7
motorized blinds okc oklahoma,0,26,0%,13.38
roller shades oklahoma city,0,25,0%,12.88
motorized shades oklahoma city,0,25,0%,15.68
custom window treatments oklahoma city,0,25,0%,17.64
plantation shutters edmond ok,0,25,0%,20.04
window blinds oklahoma city,0,25,0%,20.4
window coverings okc,0,25,0%,22.88
okc blinds,0,25,0%,27.88
blind installation oklahoma city ok,0,25,0%,32.36
blinds in okc,0,24,0%,24.25
window treatments okc,0,24,0%,27.08
blinds okc,0,24,0%,28.08
blinds oklahoma city ok,0,24,0%,28.88
blinds edmond ok,0,23,0%,16.57
window coverings edmond ok,0,23,0%,19.61
window treatments oklahoma city,0,22,0%,11.55
custom blinds oklahoma city,0,22,0%,19.82
custom blinds okc ok,0,21,0%,21.76
oklahoma city blinds,0,20,0%,25.6
oklahoma shade factory,0,17,0%,21.59
plantation shutters oklahoma city ok,0,17,0%,75.18
blinds installation near me,0,6,0%,16.5
oklahoma city motorized blinds,0,5,0%,9.6
window treatment oklahoma city,0,5,0%,10.8
oklahoma city cellular shades,0,4,0%,9.25
motorized retractable shades oklahoma city,0,4,0%,15
oklahoma city window coverings,0,4,0%,16.5
custom window covering sun prairie,0,4,0%,63
edmond custom window treatments,0,3,0%,8
motorized blinds near me,0,3,0%,10
edmond window treatments,0,3,0%,12.67
edmond custom window coverings,0,3,0%,13
oklahoma city window treatments,0,3,0%,13
window covering edmond,0,3,0%,13.33
oklahoma city roller shades,0,3,0%,15.33
oklahoma city custom window treatments,0,3,0%,17
motorized porch shades oklahoma city,0,3,0%,17.67
custom blinds edmond,0,3,0%,18
blinds near me,0,3,0%,19
custom shades edmond,0,3,0%,19
window treatments near weatherford ok,0,3,0%,28
window treatments carson,0,3,0%,72.33
edmond ok motorized window treatments,0,2,0%,3
warr acres ok electric window blinds,0,2,0%,5.5
warr acres ok custom shades for windows,0,2,0%,8
warr acres ok custom window blinds,0,2,0%,9.5
nichols hills ok blackout shades,0,2,0%,10
edmond ok sheer shade,0,2,0%,10.5
deer creek ok motorized window treatment,0,2,0%,11.5
edmond ok blackout shades for windows,0,2,0%,12
edmond ok blackout cellular shades,0,2,0%,12.5
edmond ok sheer roller shades,0,2,0%,12.5
piedmont ok motorized window treatments,0,2,0%,13
edmond ok window curtains,0,2,0%,13.5
nichols hills ok sheer shades,0,2,0%,13.5
window shades and blinds near me,0,2,0%,13.5
deer creek ok motorized window treatments,0,2,0%,14
piedmont ok custom window shade,0,2,0%,14
motorized shades near me,0,2,0%,14.5
bethany ok custom window shades,0,2,0%,15
edmond ok roller shades for windows,0,2,0%,15
window treatments near me,0,2,0%,15
bethany ok motorized window treatments,0,2,0%,15.5
oklahoma city motorized shades,0,2,0%,15.5
oklahoma city roman shades,0,2,0%,15.5
edmond ok zebra shades,0,2,0%,16
oklahoma city custom window coverings,0,2,0%,16
piedmont ok roller shade,0,2,0%,16
window covering oklahoma city,0,2,0%,16
bethany ok custom shades for windows,0,2,0%,17
custom blinds near me,0,2,0%,18
oklahoma city custom blinds and shades,0,2,0%,18
deer creek ok sheer shades,0,2,0%,19
edmond custom blinds and shades,0,2,0%,19
deer creek ok blackout shade,0,2,0%,21
warr acres ok blinds for windows,0,2,0%,23
edmond ok blinds for skylights,0,2,0%,24
window shade installation st. paul,0,2,0%,56.5
covers edmond ok,0,2,0%,58.5
window shades collinsville,0,2,0%,88.5
window blinds carson,0,2,0%,96.5
nichols hills ok motorized shades,0,1,0%,1
warr acres ok roller window shades,0,1,0%,1
shade store,0,1,0%,2
the shade store,0,1,0%,2
warr acres ok roller shades,0,1,0%,2
sun shade,0,1,0%,3
warr acres ok custom window shades,0,1,0%,3
edmond ok motorized shades,0,1,0%,4
edmond ok motorized window shades,0,1,0%,4
edmond ok motorized window treatment,0,1,0%,4
warr acres ok roller shades for windows,0,1,0%,4
edmond ok motorized blinds,0,1,0%,5
motorized blinds for windows near me,0,1,0%,5
warr acres ok custom window shade,0,1,0%,5
edmond ok roller shade,0,1,0%,6
nichols hills ok sheer roller shades,0,1,0%,6
nichols hills ok zebra roller shades,0,1,0%,6
nichols hills ok zebra shade blinds,0,1,0%,6
edmond ok roller shades,0,1,0%,7
edmond ok roman shades,0,1,0%,7
nichols hills ok blackout window shades,0,1,0%,7
nichols hills ok motorized blackout shades,0,1,0%,7
nichols hills ok sheer shade,0,1,0%,7
shading source,0,1,0%,7
edmond ok automatic blinds,0,1,0%,8
edmond ok bamboo shades,0,1,0%,8
edmond ok cordless window blinds,0,1,0%,8
edmond ok custom window shade,0,1,0%,8
edmond ok motorized blackout shades,0,1,0%,8
edmond ok zebra roller shades,0,1,0%,8
nichols hills ok blinds for windows cordless,0,1,0%,8
nichols hills ok custom shades for windows,0,1,0%,8
nichols hills ok electric window blinds,0,1,0%,8
piedmont ok motorized window treatment,0,1,0%,8
edmond ok cordless blinds,0,1,0%,9
edmond ok electric blinds for windows,0,1,0%,9
edmond ok roller window shades,0,1,0%,9
nichols hills ok cordless window blinds,0,1,0%,9
nichols hills ok custom blind,0,1,0%,9
nichols hills ok custom cordless blinds,0,1,0%,9
nichols hills ok custom window shades,0,1,0%,9
custom window treatments near me,0,1,0%,10
edmond ok cellular shade,0,1,0%,10
edmond ok custom cordless blinds,0,1,0%,10
edmond ok electric window blinds,0,1,0%,10
motorized window treatments near me,0,1,0%,10
nichols hills ok blackout cellular shades,0,1,0%,10
nichols hills ok custom window shade,0,1,0%,10
nichols hills ok window blind,0,1,0%,10
nw oklahoma city ok motorized shades,0,1,0%,10
warr acres ok blinds for skylights,0,1,0%,10
warr acres ok roller shade,0,1,0%,10
arcadia ok electric blinds for windows,0,1,0%,11
deer creek ok roller shade,0,1,0%,11
edmond ok cellular window shades,0,1,0%,11
edmond ok custom shades for windows,0,1,0%,11
luther ok motorized window treatment,0,1,0%,11
nichols hills ok mini blinds,0,1,0%,11
nichols hills ok sheer fabric shades,0,1,0%,11
nichols hills ok sheer window shades,0,1,0%,11
nichols hills ok zebra shades,0,1,0%,11
piedmont ok blackout shade,0,1,0%,11
edmond ok custom window shades,0,1,0%,12
edmond ok electric blinds,0,1,0%,12
edmond ok roman shades for windows,0,1,0%,12
motorized blinds oklahoma city,0,1,0%,12
nichols hills ok blackout shade,0,1,0%,12
nichols hills ok blinds,0,1,0%,12
nichols hills ok blinds for skylights,0,1,0%,12
nichols hills ok custom mini blinds,0,1,0%,12
nichols hills ok custom window blinds,0,1,0%,12
nichols hills ok panel track blinds,0,1,0%,12
nichols hills ok skylight blinds,0,1,0%,12
nichols hills ok wooden window blinds,0,1,0%,12
piedmont ok blackout shades,0,1,0%,12
piedmont ok blackout window shades,0,1,0%,12
piedmont ok electric blinds for windows,0,1,0%,12
piedmont ok motorized shades,0,1,0%,12
piedmont ok roller window shades,0,1,0%,12
warr acres ok custom blind,0,1,0%,12
arcadia ok motorized window treatment,0,1,0%,13
edmond ok custom blinds,0,1,0%,13
edmond ok sheer fabric shades,0,1,0%,13
edmond ok window blind,0,1,0%,13
edmond ok zebra shade blinds,0,1,0%,13
gaillardia ok sheer shades,0,1,0%,13
nichols hills ok bamboo shades,0,1,0%,13
nichols hills ok blackout roman shades,0,1,0%,13
nichols hills ok wood blinds,0,1,0%,13
piedmont ok electric window blinds,0,1,0%,13
piedmont ok roller shades,0,1,0%,13
sun shading,0,1,0%,13
arcadia ok custom blinds,0,1,0%,14
edmond ok blackout shades,0,1,0%,14
edmond ok blinds for windows cordless,0,1,0%,14
edmond ok mini blinds,0,1,0%,14
luther ok motorized blinds,0,1,0%,14
piedmont ok cellular window shades,0,1,0%,14
piedmont ok custom shades for windows,0,1,0%,14
warr acres ok custom drapery,0,1,0%,14
warr acres ok skylight blinds,0,1,0%,14
arcadia ok custom shades for windows,0,1,0%,15
deer creek ok roller shades,0,1,0%,15
deer creek ok sheer roller shades,0,1,0%,15
edmond ok blackout roman shades,0,1,0%,15
edmond ok outdoor motorized shades,0,1,0%,15
gaillardia ok roman shades,0,1,0%,15
nichols hills ok cordless mini blinds,0,1,0%,15
warr acres ok blackout shades,0,1,0%,15
arcadia ok motorized blackout shades,0,1,0%,16
deer creek ok custom shades for windows,0,1,0%,16
edmond ok cordless blinds for windows,0,1,0%,16
edmond ok draperies,0,1,0%,16
edmond ok motorized outdoor shades,0,1,0%,16
edmond ok sheer shades,0,1,0%,16
mustang ok custom window shade,0,1,0%,16
nichols hills ok roller shade,0,1,0%,16
oklahoma city ok cellular shade,0,1,0%,16
oklahoma city ok motorized shades,0,1,0%,16
warr acres ok sheer fabric shades,0,1,0%,16
arcadia ok roller shades,0,1,0%,17
bethany ok cellular window shades,0,1,0%,17
bethany ok roller shade,0,1,0%,17
bethany ok roller window shades,0,1,0%,17
edmond ok blind repair,0,1,0%,17
edmond ok custom blind,0,1,0%,17
edmond ok custom drapery,0,1,0%,17
edmond ok custom drapes,0,1,0%,17
edmond ok custom window blinds,0,1,0%,17
edmond ok outdoor shades,0,1,0%,17
edmond ok window blinds,0,1,0%,17
el reno ok custom window shade,0,1,0%,17
nichols hills ok blinds mini blinds,0,1,0%,17
oklahoma city ok motorized window shades,0,1,0%,17
warr acres ok exterior roller shades,0,1,0%,17
arcadia ok custom cordless blinds,0,1,0%,18
bethany ok custom window shade,0,1,0%,18
bethany ok electric window blinds,0,1,0%,18
choctaw ok cellular shades,0,1,0%,18
deer creek ok roller shades for windows,0,1,0%,18
edmond ok bamboo shade,0,1,0%,18
edmond ok blinds,0,1,0%,18
edmond ok exterior window shades,0,1,0%,18
edmond ok motorized exterior shades,0,1,0%,18
edmond ok outdoor roller shades,0,1,0%,18
gaillardia ok custom shades for windows,0,1,0%,18
mustang ok custom window shades,0,1,0%,18
nichols hills ok blinds for windows,0,1,0%,18
nichols hills ok custom blinds,0,1,0%,18
nw oklahoma city ok cellular shades,0,1,0%,18
oklahoma city ok automatic blinds,0,1,0%,18
oklahoma city ok custom window shades,0,1,0%,18
oklahoma city ok motorized window treatments,0,1,0%,18
piedmont ok custom window shades,0,1,0%,18
warr acres ok outdoor shades for patio,0,1,0%,18
window blinds okc,0,1,0%,18
bethany ok exterior roller shades,0,1,0%,19
bethany ok roman shades,0,1,0%,19
choctaw ok motorized shades,0,1,0%,19
custom shades near me,0,1,0%,19
deer creek ok blackout window shades,0,1,0%,19
edmond ok blinds mini blinds,0,1,0%,19
edmond ok roller shades blackout,0,1,0%,19
gaillardia ok blackout roman shade,0,1,0%,19
gaillardia ok blackout shades,0,1,0%,19
luther ok custom window shade,0,1,0%,19
luther ok motorized window treatments,0,1,0%,19
mustang ok motorized window treatment,0,1,0%,19
nw oklahoma city ok motorized window shades,0,1,0%,19
nw oklahoma city ok sheer shade,0,1,0%,19
nw oklahoma city ok sheer shades,0,1,0%,19
oklahoma city ok cellular shades,0,1,0%,19
oklahoma city ok custom shades for windows,0,1,0%,19
oklahoma city ok electric window blinds,0,1,0%,19
oklahoma city ok sheer window shades,0,1,0%,19
sapulpa ok motorized window treatment,0,1,0%,19
yukon ok custom window shade,0,1,0%,19
yukon ok custom window shades,0,1,0%,19
arcadia ok custom window shade,0,1,0%,20
bethany ok roller shades,0,1,0%,20
deer creek ok custom window shades,0,1,0%,20
edmond ok plantation shutters,0,1,0%,20
el reno ok roller window shades,0,1,0%,20
luther ok custom window shades,0,1,0%,20
oklahoma city custom blinds,0,1,0%,20
oklahoma city ok blackout roman shades,0,1,0%,20
oklahoma city ok sheer shade,0,1,0%,20
tuttle ok motorized window treatments,0,1,0%,20
yukon ok cellular window shades,0,1,0%,20
yukon ok sheer shade,0,1,0%,20
edmond ok outdoor shades for patio,0,1,0%,21
oklahoma city ok bamboo shades,0,1,0%,21
oklahoma city ok custom blinds,0,1,0%,21
oklahoma city ok window blind,0,1,0%,21
warr acres ok window blinds,0,1,0%,21
deer creek ok custom cordless blinds,0,1,0%,22
edmond ok blinds repair,0,1,0%,22
glenpool ok motorized window treatments,0,1,0%,22
bethany ok roman shade,0,1,0%,23
bethany ok roman shades for windows,0,1,0%,23
luther ok sheer window shades,0,1,0%,23
oklahoma city ok blackout shades,0,1,0%,23
oklahoma city ok motorized blackout shades,0,1,0%,23
owasso ok motorized window treatments,0,1,0%,23
window coverings near me,0,1,0%,24
arcadia ok motorized shades,0,1,0%,25
bethany ok exterior window shades,0,1,0%,25
deer creek ok blackout shades,0,1,0%,26
oklahoma city ok blinds for windows,0,1,0%,26
sapulpa ok sheer shade,0,1,0%,26
bethany ok blinds for windows,0,1,0%,27
bethany ok custom blinds,0,1,0%,27
luther ok blackout shades for windows,0,1,0%,27
oklahoma city ok electric blinds,0,1,0%,27
jenks ok roller shades,0,1,0%,28
oklahoma city ok window blinds,0,1,0%,28
sapulpa ok custom window shade,0,1,0%,28
bethany ok blackout shades,0,1,0%,29
oklahoma city ok outdoor shades,0,1,0%,29
piedmont ok motorized blackout shades,0,1,0%,29
deer creek ok exterior window shades,0,1,0%,30
sunrooms and more edmond ok,0,1,0%,30
roller shades installers shady hollow,0,1,0%,37
blind alley okc,0,1,0%,39
sunroom installation services oklahoma city,0,1,0%,41
shades greenwich,0,1,0%,42
windows for sunroom in oklahoma,0,1,0%,44
shady lady okc,0,1,0%,52
plantation shutters near me,0,1,0%,57
blinds richmond hill,0,1,0%,61
custom window covers redmond,0,1,0%,62
timber shade,0,1,0%,74
roll down shades midlothian,0,1,0%,75
window treatment installation richmond,0,1,0%,77
outdoor motorized shades richmond va,0,1,0%,84
shades for windows carson,0,1,0%,100